Symbol,Name,Last Sale,Net Change,% Change,Market Cap,Country,IPO Year,Volume,Sector,Industry,Exchange
UCBIO,United Community Banks Inc. Depositary Shares each representing 1/1000th interest in a share of Series I Non-CumulativePreferred Stock,$27.37,0.075,0.28%,0,United States,,8051,Finance,Major Banks,NASDAQ
UCL,uCloudlink Group Inc. American Depositary Shares,$10.38,0.25,2.47%,292250872,Hong Kong,2020,35899,Consumer Services,Telecommunications Equipment,NASDAQ
UCTT,Ultra Clean Holdings Inc. Common Stock,$43.36,-0.06,-0.14%,1756080000,United States,2004,359575,Technology,Semiconductors,NASDAQ
UEIC,Universal Electronics Inc. Common Stock,$60.16,1.13,1.91%,827180508,United States,1993,68802,Consumer Non-Durables,Consumer Electronics/Appliances,NASDAQ
UEPS,Net 1 UEPS Technologies Inc. Common Stock,$5.13,0.07,1.38%,290556659,South Africa,2005,111085,Finance,Investment Bankers/Brokers/Service,NASDAQ
UFCS,United Fire Group Inc. Common Stock,$30.85,0.33,1.08%,772213569,United States,,90058,Finance,Property-Casualty Insurers,NASDAQ
UFPI,UFP Industries Inc. Common Stock,$60.26,0.7,1.18%,3687106685,United States,1993,328936,Basic Industries,Forest Products,NASDAQ
UFPT,UFP Technologies Inc. Common Stock,$46.24,0.01,0.02%,346558812,United States,1993,27142,Health Care,Medical/Dental Instruments,NASDAQ
UG,United-Guardian Inc. Common Stock,$14.23,0.125,0.89%,65354188,United States,,8427,Consumer Non-Durables,Package Goods/Cosmetics,NASDAQ
UHAL,Amerco Common Stock,$474.62,-2.96,-0.62%,9306248341,United States,,27121,Consumer Services,Rental/Leasing Companies,NASDAQ
UIHC,United Insurance Holdings Corp. Common Stock,$5.68,0.01,0.18%,244696729,United States,,103940,Finance,Property-Casualty Insurers,NASDAQ
UK,Ucommune International Ltd Ordinary Shares,$4.90,0.01,0.20%,394214031,United States,2019,349443,Miscellaneous,Business Services,NASDAQ
UKOMW,Ucommune International Ltd Warrant expiring 11/17/2025,$0.20,-0.0112,-5.30%,0,United States,2019,185394,Miscellaneous,Business Services,NASDAQ
ULBI,Ultralife Corporation Common Stock,$6.80,0.02,0.30%,108310774,United States,1992,86936,Miscellaneous,Industrial Machinery/Components,NASDAQ
ULH,Universal Logistics Holdings Inc. Common Stock,$23.26,0.25,1.09%,625986611,United States,,56317,Transportation,Trucking Freight/Courier Services,NASDAQ
ULTA,Ulta Beauty Inc. Common Stock,$299.92,-0.32,-0.11%,16897084609,United States,2007,595295,Consumer Services,Other Specialty Stores,NASDAQ
UMBF,UMB Financial Corporation Common Stock,$75.18,2.95,4.08%,3610960055,United States,,236972,Finance,Major Banks,NASDAQ
UMPQ,Umpqua Holdings Corporation Common Stock,$16.04,0.27,1.71%,3532425040,United States,,1407470,Finance,Savings Institutions,NASDAQ
UNAM,Unico American Corporation Common Stock,$5.46,0.06,1.11%,28965912,United States,,1811,Finance,Property-Casualty Insurers,NASDAQ
UNB,Union Bankshares Inc. Common Stock,$26.51,0.13,0.49%,118640574,United States,,18975,Finance,Major Banks,NASDAQ
UNIT,Uniti Group Inc. Common Stock,$12.70,-0.06,-0.47%,2955912414,United States,,2020230,Consumer Services,Real Estate Investment Trusts,NASDAQ
UNTY,Unity Bancorp Inc. Common Stock,$19.38,1.31,7.25%,204760165,United States,,24903,Finance,Major Banks,NASDAQ
UONE,Urban One Inc. Class A Common Stock,$5.91,-0.07,-1.17%,282191773,United States,,597870,Consumer Services,Broadcasting,NASDAQ
UONEK,Urban One Inc. Class D Common Stock,$1.60,0.04,2.56%,76397096,United States,,257553,Consumer Services,Broadcasting,NASDAQ
UPLD,Upland Software Inc. Common Stock,$49.86,1.05,2.15%,1469087704,United States,2014,330480,Technology,Computer Software: Prepackaged Software,NASDAQ
UPST,Upstart Holdings Inc. Common stock,$64.47,0.7,1.10%,4671552998,United States,2020,1241616,Finance,Finance: Consumer Services,NASDAQ
UPWK,Upwork Inc. Common Stock,$41.35,1.3,3.25%,5047741417,United States,2018,1396470,Technology,EDP Services,NASDAQ
URBN,Urban Outfitters Inc. Common Stock,$26.76,0.2,0.75%,2616763556,United States,1993,2220845,Consumer Services,Clothing/Shoe/Accessory Stores,NASDAQ
URGN,UroGen Pharma Ltd. Ordinary Shares,$21.00,0.09,0.43%,463954134,Israel,2017,164130,Health Care,Major Pharmaceuticals,NASDAQ
UROV,Urovant Sciences Ltd. Common Stock,$16.24,0.05,0.31%,515149332,United Kingdom,2018,53747,Health Care,Major Pharmaceuticals,NASDAQ
USAK,USA Truck Inc. Common Stock,$11.05,-0.33,-2.90%,96801492,United States,1992,98175,Transportation,Trucking Freight/Courier Services,NASDAQ
USAP,Universal Stainless & Alloy Products Inc. Common Stock,$7.87,0.07,0.90%,69489991,United States,1994,44535,Basic Industries,Steel/Iron Ore,NASDAQ
USAT,USA Technologies Inc. Common Stock,$10.54,-0.06,-0.57%,687804891,United States,,178837,Miscellaneous,Office Equipment/Supplies/Services,NASDAQ
USAU,U.S. Gold Corp. Common Stock,$13.13,0.05,0.38%,75585615,United States,,23258,Basic Industries,Precious Metals,NASDAQ
USCR,U.S. Concrete Inc. Common Stock,$47.80,-0.08,-0.17%,797098699,United States,,363641,Capital Goods,Building Materials,NASDAQ
USEG,U.S. Energy Corp. Common Stock,$4.55,0.05,1.11%,14758626,United States,,355017,Energy,Oil & Gas Production,NASDAQ
USIO,Usio Inc. Common Stock,$3.02,-0.01,-0.33%,75424485,United States,,62817,Finance,Investment Bankers/Brokers/Service,NASDAQ
USLM,United States Lime & Minerals Inc. Common Stock,$128.36,-2.64,-2.02%,722764482,United States,,11002,Basic Industries,Mining & Quarrying of Nonmetallic Minerals (No Fuels),NASDAQ
USWS,U.S. Well Services Inc. Class A Common Stock,$0.85,0.117,16.05%,62662623,United States,2017,19806325,Energy,Oilfield Services/Equipment,NASDAQ
USWSW,U.S. Well Services Inc. Warrants,$0.15,0.0063,4.39%,0,United States,2017,358581,Energy,Oilfield Services/Equipment,NASDAQ
UTHR,United Therapeutics Corporation Common Stock,$167.71,0.57,0.34%,7453121957,United States,1999,203480,Health Care,Major Pharmaceuticals,NASDAQ
UTMD,Utah Medical Products Inc. Common Stock,$87.23,0.86,1.00%,317552354,United States,,9991,Health Care,Medical/Dental Instruments,NASDAQ
UTSI,UTStarcom Holdings Corp.,$1.86,-0.06,-3.13%,66821808,China,2000,250362,Capital Goods,Telecommunications Equipment,NASDAQ
UVSP,Univest Financial Corporation Common Stock,$23.39,0.305,1.32%,684557750,United States,,84425,Finance,Major Banks,NASDAQ
UXIN,Uxin Limited ADS,$1.27,-0.04,-3.05%,433612190,China,2018,15589568,Miscellaneous,Business Services,NASDAQ
VACQ,Vector Acquisition Corporation Class A Common Stock,$10.50,0.08,0.77%,399000000,United States,2020,82242,Finance,Business Services,NASDAQ
VACQU,Vector Acquisition Corporation Unit,$11.00,0.05,0.46%,0,United States,2020,47214,Finance,Business Services,NASDAQ
VACQW,Vector Acquisition Corporation Warrant,$1.84,0.1099,6.35%,0,United States,2020,87004,Finance,Business Services,NASDAQ
VALU,Value Line Inc. Common Stock,$30.65,0.88,2.96%,293913486,United States,1983,7345,Finance,Investment Managers,NASDAQ
VBFC,Village Bank and Trust Financial Corp. Common Stock,$33.85,0.0989,0.29%,49631412,United States,,1150,Finance,Major Banks,NASDAQ
VBIV,VBI Vaccines Inc. New Common Stock (Canada),$3.08,0,0.00%,745522396,United States,,7246474,Health Care,Major Pharmaceuticals,NASDAQ
VBLT,Vascular Biogenics Ltd. Ordinary Shares,$2.69,0.13,5.08%,129624275,Israel,2014,3436924,Health Care,Major Pharmaceuticals,NASDAQ
VBTX,Veritex Holdings Inc. Common Stock,$28.38,0.29,1.03%,1409385764,United States,2014,262414,Finance,Major Banks,NASDAQ
VC,Visteon Corporation Common Stock,$140.07,-2.16,-1.52%,3898541276,United States,,179605,Capital Goods,Auto Parts:O.E.M.,NASDAQ
VCEL,Vericel Corporation Common Stock,$41.23,1.08,2.69%,1873029177,United States,,574731,Health Care,Biotechnology: Biological Products (No Diagnostic Substances),NASDAQ
VCKAU,Vickers Vantage Corp. I Unit,$10.34,0.01,0.10%,0,Singapore,2021,87930,Finance,Business Services,NASDAQ
VCNX,Vaccinex Inc. Common Stock,$2.55,-0.12,-4.49%,57083351,United States,2018,1337296,Health Care,Major Pharmaceuticals,NASDAQ
VCTR,Victory Capital Holdings Inc. Class A Common Stock,$23.39,-0.55,-2.30%,1578365363,United States,2018,61451,Finance,Investment Managers,NASDAQ
VCVC,10X Capital Venture Acquisition Corp Class A Common Stock,$10.68,-0.05,-0.47%,268668750,United States,2021,57221,Finance,Business Services,NASDAQ
VCVCU,10X Capital Venture Acquisition Corp Unit,$11.65,0.1,0.87%,0,United States,2020,28394,Finance,Business Services,NASDAQ
VCVCW,10X Capital Venture Acquisition Corp Warrant,$2.40,0.0856,3.70%,0,United States,2021,34365,Finance,Business Services,NASDAQ
VCYT,Veracyte Inc. Common Stock,$55.24,1.27,2.35%,3198248012,United States,2013,493351,Health Care,Medical Specialities,NASDAQ
VECO,Veeco Instruments Inc. Common Stock,$20.68,0.04,0.19%,1025979614,United States,1994,193602,Technology,Industrial Machinery/Components,NASDAQ
VEON,VEON Ltd. ADS,$1.80,0.03,1.70%,3148429327,Netherlands,,1998530,Public Utilities,Telecommunications Equipment,NASDAQ
VERB,Verb Technology Company Inc. Common Stock,$1.79,-0.04,-2.19%,91352188,United States,,524992,Consumer Services,Other Consumer Services,NASDAQ
VERBW,Verb Technology Company Inc. Warrant,$0.45,-0.0078,-1.71%,0,United States,,630,Consumer Services,Other Consumer Services,NASDAQ
VERI,Veritone Inc. Common Stock,$41.65,2.17,5.50%,1324443094,United States,2017,649917,Technology,EDP Services,NASDAQ
VERO,Venus Concept Inc. Common Stock,$2.37,0.05,2.16%,97484928,United States,2017,875087,Health Care,Medical/Dental Instruments,NASDAQ
VERU,Veru Inc. Common Stock,$9.02,0.09,1.01%,632080649,United States,,1293733,Health Care,Major Pharmaceuticals,NASDAQ
VERX,Vertex Inc. Class A Common Stock,$33.32,1.63,5.14%,4868202040,United States,2020,325333,Technology,Computer Software: Prepackaged Software,NASDAQ
VERY,Vericity Inc. Common Stock,$9.15,0.02,0.22%,136106250,United States,2019,2699,Finance,Life Insurance,NASDAQ
VFF,Village Farms International Inc. Common Shares,$12.52,-0.41,-3.17%,974292728,Canada,,2443567,Consumer Non-Durables,Farming/Seeds/Milling,NASDAQ
VG,Vonage Holdings Corp. Common Stock,$13.47,0.34,2.59%,3345042493,United States,2006,2841726,Public Utilities,Telecommunications Equipment,NASDAQ
VIAC,ViacomCBS Inc. Class B Common Stock,$45.58,0.47,1.04%,28134074184,United States,,14450430,Consumer Services,Broadcasting,NASDAQ
VIACA,ViacomCBS Inc. Class A Common Stock,$46.00,0.61,1.34%,28393317518,United States,,47653,Consumer Services,Broadcasting,NASDAQ
VIAV,Viavi Solutions Inc. Common Stock,$16.06,-0.045,-0.28%,3677639464,United States,,1310472,Technology,Semiconductors,NASDAQ
VICR,Vicor Corporation Common Stock,$98.57,-0.48,-0.49%,4265642575,United States,,132297,Capital Goods,Industrial Machinery/Components,NASDAQ
VIE,Viela Bio Inc. Common Stock,$34.87,0.93,2.74%,1912185055,United States,2019,115261,Health Care,Major Pharmaceuticals,NASDAQ
VIH,VPC Impact Acquisition Holdings Class A Ordinary Shares,$15.02,0.13,0.87%,389340960,United States,2020,1412392,Finance,Business Services,NASDAQ
VIHAU,VPC Impact Acquisition Holdings Unit,$16.89,0.19,1.14%,0,United States,2020,35504,Finance,Business Services,NASDAQ
VIHAW,VPC Impact Acquisition Holdings Warrant,$4.00,0.12,3.09%,0,United States,2020,314033,Finance,Business Services,NASDAQ
VIIAU,7GC & Co. Holdings Inc. Unit,$10.57,0.08,0.76%,0,United States,2020,29772,Finance,Business Services,NASDAQ
VINC,Vincerx Pharma Inc. Common Stock,$20.81,-0.66,-3.07%,291016217,United States,2020,82382,Health Care,Major Pharmaceuticals,NASDAQ
VINCU,Vincerx Pharma Inc. Unit,$24.50,0,0.00%,0,United States,2020,25,Health Care,Major Pharmaceuticals,NASDAQ
VINCW,Vincerx Pharma Inc. Warrant,$4.50,0.05,1.12%,0,United States,2020,23491,Health Care,Major Pharmaceuticals,NASDAQ
VIOT,Viomi Technology Co. Ltd American Depositary Shares,$7.40,-0.06,-0.80%,514176657,China,2018,460453,Consumer Durables,Consumer Electronics/Appliances,NASDAQ
VIR,Vir Biotechnology Inc. Common Stock,$40.53,-1.87,-4.41%,5163060769,United States,2019,1059172,Health Care,Biotechnology: Biological Products (No Diagnostic Substances),NASDAQ
VIRC,Virco Manufacturing Corporation Common Stock,$2.74,-0.0199,-0.72%,43618671,United States,,16373,Consumer Durables,Industrial Specialties,NASDAQ
VIRI,Virios Therapeutics Inc. Common Stock,$7.80,0.06,0.78%,64603453,United States,2020,120638,Health Care,Major Pharmaceuticals,NASDAQ
VIRT,Virtu Financial Inc. Class A Common Stock,$24.84,0.11,0.45%,4805984950,United States,2015,762043,Finance,Investment Bankers/Brokers/Service,NASDAQ
VISL,Vislink Technologies Inc. Common Stock,$2.54,0.03,1.20%,53032101,United States,2013,6325575,Capital Goods,Telecommunications Equipment,NASDAQ
VITL,Vital Farms Inc. Common Stock,$26.34,1.62,6.55%,1038643121,United States,2020,449692,Consumer Non-Durables,Packaged Foods,NASDAQ
VIVE,Viveve Medical Inc. Common Stock,$3.43,-0.03,-0.87%,26884601,United States,,2225980,Health Care,Biotechnology: Electromedical & Electrotherapeutic Apparatus,NASDAQ
VIVO,Meridian Bioscience Inc. Common Stock,$22.97,0.37,1.64%,990537308,United States,1986,336472,Health Care,Biotechnology: In Vitro & In Vivo Diagnostic Substances,NASDAQ
VJET,voxeljet AG American Depositary Shares,$17.94,1.35,8.14%,86757840,Germany,,102459,Capital Goods,Industrial Machinery/Components,NASDAQ
VKTX,Viking Therapeutics Inc. Common Stock,$6.82,0.03,0.44%,497532449,United States,2015,968809,Health Care,Major Pharmaceuticals,NASDAQ
VKTXW,Viking Therapeutics Inc. Warrants,$5.28,-0.1199,-2.22%,0,United States,,4000,Health Care,Major Pharmaceuticals,NASDAQ
VLDR,Velodyne Lidar Inc. Common Stock,$23.15,0.01,0.04%,3905712802,United States,,3180123,Capital Goods,Industrial Machinery/Components,NASDAQ
VLDRW,Velodyne Lidar Inc. Warrants,$8.65,-0.05,-0.58%,0,United States,,323516,Capital Goods,Industrial Machinery/Components,NASDAQ
VLGEA,Village Super Market Inc. Class A Common Stock,$21.82,-0.245,-1.11%,317608342,United States,,55866,Consumer Services,Food Chains,NASDAQ
VLY,Valley National Bancorp Common Stock,$10.99,0.34,3.19%,4438600636,United States,,2188540,Finance,Major Banks,NASDAQ
VLYPO,Valley National Bancorp 5.50% Fixed-to-Floating Rate Non-Cumulative Perpetual Preferred Stock Series B,$25.72,0.0311,0.12%,0,United States,,2179,Finance,Major Banks,NASDAQ
VLYPP,Valley National Bancorp 6.25% Fixed-to-Floating Rate Non-Cumulative Perpetual Preferred Stock Series A,$28.43,0.075,0.27%,0,United States,,3389,Finance,Major Banks,NASDAQ
VMAC,Vistas Media Acquisition Company Inc. Class A Common Stock,$10.24,-0.01,-0.10%,141619200,United States,2020,2486,Finance,Business Services,NASDAQ
VMACU,Vistas Media Acquisition Company Inc. Unit,$10.91,-0.3855,-3.41%,0,United States,2020,1452,Finance,Business Services,NASDAQ
VMACW,Vistas Media Acquisition Company Inc. Warrant,$0.99,-0.05,-4.81%,0,United States,2020,109888,Finance,Business Services,NASDAQ
VMAR,Vision Marine Technologies Inc. Common Shares,$15.64,0.04,0.26%,125282124,Canada,2020,429287,Capital Goods,Marine Transportation,NASDAQ
VMD,Viemed Healthcare Inc. Common Shares,$8.62,-0.02,-0.23%,337431469,United States,,114314,Health Care,Misc Health and Biotechnology Services,NASDAQ
VNDA,Vanda Pharmaceuticals Inc. Common Stock,$14.20,-0.35,-2.41%,776621487,United States,2006,345745,Health Care,Major Pharmaceuticals,NASDAQ
VNET,21Vianet Group Inc. American Depositary Shares,$41.17,2.26,5.81%,5472436287,China,2011,5250602,Technology,Computer Software: Programming Data Processing,NASDAQ
VNOM,Viper Energy Partners LP Common Unit,$14.60,0.26,1.81%,2315154514,United States,2014,880451,Energy,Oil & Gas Production,NASDAQ
VOD,Vodafone Group Plc American Depositary Shares,$17.58,-0.05,-0.28%,47174243287,United Kingdom,,1817079,Public Utilities,Telecommunications Equipment,NASDAQ
VOSOU,Virtuoso Acquisition Corp. Unit,$10.30,0.3,3.00%,0,United States,2021,9414979,Finance,Business Services,NASDAQ
VOXX,VOXX International Corporation Class A Common Stock,$21.33,-0.3,-1.39%,510382747,United States,,234027,Technology,Electronic Components,NASDAQ
VRA,Vera Bradley Inc. Common Stock,$8.47,0.04,0.47%,283020730,United States,2010,201875,Consumer Non-Durables,Apparel,NASDAQ
VRAY,ViewRay Inc. Common Stock,$4.48,-0.81,-15.31%,718395332,United States,,7615089,Health Care,Biotechnology: Electromedical & Electrotherapeutic Apparatus,NASDAQ
VRCA,Verrica Pharmaceuticals Inc. Common Stock,$12.64,0.94,8.03%,326940451,United States,2018,132548,Health Care,Major Pharmaceuticals,NASDAQ
VRDN,Viridian Therapeutics Inc. Common Stock,$21.78,1.71,8.52%,85119681,United States,2014,55891,,,NASDAQ
VREX,Varex Imaging Corporation Common Stock,$20.27,0.55,2.79%,794008373,United States,,733229,Capital Goods,Industrial Machinery/Components,NASDAQ
VRM,Vroom Inc. Common Stock,$36.55,-0.19,-0.52%,4760321014,United States,2020,2400769,Consumer Durables,Automotive Aftermarket,NASDAQ
VRME,VerifyMe Inc. Common Stock,$4.87,0.58,13.52%,27275424,United States,,183283,Basic Industries,Major Chemicals,NASDAQ
VRMEW,VerifyMe Inc. Warrant,$1.30,0.185,16.59%,0,United States,,17176,Basic Industries,Major Chemicals,NASDAQ
VRNA,Verona Pharma plc American Depositary Share,$7.80,-0.01,-0.13%,404181944,United Kingdom,2017,16446,Health Care,Major Pharmaceuticals,NASDAQ
VRNS,Varonis Systems Inc. Common Stock,$184.02,3.73,2.07%,5838385242,United States,2014,242020,Technology,Computer Software: Prepackaged Software,NASDAQ
VRNT,Verint Systems Inc. Common Stock,$72.18,0.68,0.95%,5016510000,United States,2002,917099,Technology,EDP Services,NASDAQ
VRRM,Verra Mobility Corporation Class A Common Stock,$13.51,0.505,3.88%,2192252366,United States,2017,1375613,Consumer Services,Transportation Services,NASDAQ
VRSK,Verisk Analytics Inc. Common Stock,$192.76,-2.11,-1.08%,31340809270,United States,2009,521147,Technology,EDP Services,NASDAQ
VRSN,VeriSign Inc. Common Stock,$194.75,-2.39,-1.21%,22222896793,United States,1998,448267,Technology,EDP Services,NASDAQ
VRTS,Virtus Investment Partners Inc. Common Stock,$223.03,3.16,1.44%,1697961737,United States,,70923,Finance,Investment Managers,NASDAQ
VRTU,Virtusa Corporation Common Stock,$51.16,-0.02,-0.04%,1550634480,United States,2007,271669,Technology,EDP Services,NASDAQ
VRTX,Vertex Pharmaceuticals Incorporated Common Stock,$237.59,-1.05,-0.44%,61782403235,United States,1991,1258224,Health Care,Major Pharmaceuticals,NASDAQ
VS,Versus Systems Inc. Common Shares,$8.64,0.61,7.60%,81128062,Canada,,68305,Technology,EDP Services,NASDAQ
VSAT,ViaSat Inc. Common Stock,$40.75,1.66,4.25%,2777018938,United States,1996,705622,Technology,Radio And Television Broadcasting And Communications Equipment,NASDAQ
VSEC,VSE Corporation Common Stock,$41.39,1.25,3.11%,457400724,United States,,22087,Consumer Services,Military/Government/Technical,NASDAQ
VSPR,Vesper Healthcare Acquisition Corp. Class A Common Stock,$11.11,-0.07,-0.63%,638825000,United States,2020,1024056,Finance,Business Services,NASDAQ
VSPRU,Vesper Healthcare Acquisition Corp. Unit,$11.91,-0.09,-0.75%,0,United States,2020,5874,Finance,Business Services,NASDAQ
VSPRW,Vesper Healthcare Acquisition Corp. Warrant,$2.53,-0.01,-0.39%,0,United States,2020,61429,Finance,Business Services,NASDAQ
VSSYW,Versus Systems Inc. Class A Warrants,$3.75,0.6399,20.58%,0,Canada,,21887,Technology,EDP Services,NASDAQ
VSTA,Vasta Platform Limited Class A Ordinary Shares,$13.70,-0.06,-0.44%,1137258715,Brazil,2020,17716,Consumer Services,Other Consumer Services,NASDAQ
VSTM,Verastem Inc. Common Stock,$2.20,0.01,0.46%,373503750,United States,2012,2310104,Health Care,Major Pharmaceuticals,NASDAQ
VTAQU,Ventoux CCM Acquisition Corp. Unit,$10.55,0.05,0.48%,0,United States,2020,32441,Finance,Business Services,NASDAQ
VTGN,VistaGen Therapeutics Inc. Common Stock,$2.21,0.14,6.76%,306180450,United States,,1647398,Health Care,Major Pharmaceuticals,NASDAQ
VTIQU,VectoIQ Acquisition Corp. II Unit,$11.53,0.02,0.17%,0,United States,2021,284350,Finance,Business Services,NASDAQ
VTNR,Vertex Energy Inc Common Stock,$1.28,0.19,17.43%,58310196,United States,,2410859,Energy,Integrated oil Companies,NASDAQ
VTRS,Viatris Inc. Common Stock,$17.43,0.12,0.69%,20954418474,United States,,5726564,Health Care,Major Pharmaceuticals,NASDAQ
VTRU,Vitru Limited Common Shares,$15.24,-0.36,-2.31%,351404728,Brazil,2020,13738,Consumer Services,Other Consumer Services,NASDAQ
VTSI,VirTra Inc. Common Stock,$4.05,0.055,1.38%,31419659,United States,,7687,Consumer Durables,Miscellaneous manufacturing industries,NASDAQ
VTVT,vTv Therapeutics Inc. Class A Common Stock,$2.20,0.07,3.29%,170818848,United States,2015,1714780,Health Care,Major Pharmaceuticals,NASDAQ
VUZI,Vuzix Corporation Common Stock,$12.37,1.47,13.49%,528429886,United States,,11228753,Technology,Radio And Television Broadcasting And Communications Equipment,NASDAQ
VVOS,Vivos Therapeutics Inc. Common Stock,$6.70,-0.37,-5.23%,117250060,United States,2020,120813,Health Care,Medical/Dental Instruments,NASDAQ
VVPR,VivoPower International PLC Ordinary Shares,$13.88,0.27,1.98%,235123397,United Kingdom,,1041808,Public Utilities,Power Generation,NASDAQ
VXRT,Vaxart Inc Common Stock,$7.14,0.18,2.59%,781608267,United States,,5037422,Health Care,Biotechnology: Biological Products (No Diagnostic Substances),NASDAQ
VYGR,Voyager Therapeutics Inc. Common Stock,$9.04,0.39,4.51%,338690624,United States,2015,318838,Health Care,Biotechnology: Biological Products (No Diagnostic Substances),NASDAQ
VYNE,VYNE Therapeutics Inc. Common Stock,$1.88,0.01,0.54%,315611854,United States,2018,2835520,Health Care,Major Pharmaceuticals,NASDAQ
WABC,Westamerica Bancorporation Common Stock,$61.52,1.44,2.40%,1649166640,United States,,103342,Finance,Major Banks,NASDAQ
WAFD,Washington Federal Inc. Common Stock,$28.57,0.18,0.63%,2167523190,United States,,371889,Finance,Major Banks,NASDAQ
WAFU,Wah Fu Education Group Limited Ordinary Shares,$4.64,0.2,4.51%,20327993,China,2019,57782,Consumer Services,Other Consumer Services,NASDAQ
WASH,Washington Trust Bancorp Inc. Common Stock,$46.65,0.79,1.72%,805401474,United States,,76191,Finance,Major Banks,NASDAQ
WATT,Energous Corporation Common Stock,$3.39,0.22,6.94%,151013408,United States,2014,5873024,Technology,Radio And Television Broadcasting And Communications Equipment,NASDAQ
WB,Weibo Corporation American Depositary Share,$42.96,0.02,0.05%,9728807520,China,2014,1095735,Technology,Computer Software: Programming Data Processing,NASDAQ
WBA,Walgreens Boots Alliance Inc. Common Stock,$47.45,0.38,0.81%,40998775581,United States,,4679523,Health Care,Medical/Nursing Services,NASDAQ
WDAY,Workday Inc. Class A Common Stock,$235.53,6.14,2.68%,56527200000,United States,,1792017,Technology,EDP Services,NASDAQ
WDC,Western Digital Corporation Common Stock,$50.71,-2.8,-5.23%,15428266232,United States,,5237347,Technology,Electronic Components,NASDAQ
WDFC,WD-40 Company Common Stock,$288.93,5.65,1.99%,3954932493,United States,1973,86571,Basic Industries,Major Chemicals,NASDAQ
WEN,Wendy's Company (The) Common Stock,$20.85,-0.39,-1.84%,4672876188,United States,,2126101,Consumer Services,Restaurants,NASDAQ
WERN,Werner Enterprises Inc. Common Stock,$42.96,0.325,0.76%,2968101411,United States,1986,456911,Transportation,Trucking Freight/Courier Services,NASDAQ
WETF,WisdomTree Investments Inc. Common Stock,$5.43,0.1,1.88%,807883925,United States,,1228395,Finance,Investment Bankers/Brokers/Service,NASDAQ
WEYS,Weyco Group Inc. Common Stock,$16.98,0.15,0.89%,166752362,United States,,18778,Consumer Non-Durables,Apparel,NASDAQ
WHF,WhiteHorse Finance Inc. Common Stock,$13.62,0.07,0.52%,279836956,United States,,76615,,,NASDAQ
WHFBZ,WhiteHorse Finance Inc. 6.50% Notes due 2025,$25.77,0.12,0.47%,0,United States,,441,,,NASDAQ
WHLM,Wilhelmina International Inc. Common Stock,$4.71,0,0.00%,24291090,United States,,31611,Consumer Services,Professional Services,NASDAQ
WHLR,Wheeler Real Estate Investment Trust Inc. Common Stock,$2.78,0,0.00%,26973737,United States,2012,4420,Consumer Services,Real Estate Investment Trusts,NASDAQ
WHLRD,Wheeler Real Estate Investment Trust Inc. Series D Cumulative Preferred Stock,$17.61,-0.14,-0.79%,0,United States,,11603,Consumer Services,Real Estate Investment Trusts,NASDAQ
WHLRP,Wheeler Real Estate Investment Trust Inc. Class B Preferred Stock,$12.53,-0.4698,-3.61%,0,United States,,3808,Consumer Services,Real Estate Investment Trusts,NASDAQ
WIFI,Boingo Wireless Inc. Common Stock,$12.20,0.12,0.99%,543276785,United States,2011,410773,Consumer Services,Telecommunications Equipment,NASDAQ
WILC,G. Willi-Food International  Ltd. Ordinary Shares,$20.83,-0.27,-1.28%,275310464,Israel,,3153,Consumer Non-Durables,Food Distributors,NASDAQ
WIMI,WiMi Hologram Cloud Inc. American Depositary Share,$8.57,-0.01,-0.12%,572344930,China,2020,11197572,Technology,Computer Software: Prepackaged Software,NASDAQ
WINA,Winmark Corporation Common Stock,$183.99,2.45,1.35%,688177061,United States,,12492,Consumer Services,Other Specialty Stores,NASDAQ
WING,Wingstop Inc. Common Stock,$155.44,1.36,0.88%,4613997800,United States,2015,306238,Consumer Services,Restaurants,NASDAQ
WINT,Windtree Therapeutics Inc. Common Stock,$5.44,-0.23,-4.06%,92052862,United States,,22895,Health Care,Biotechnology: Biological Products (No Diagnostic Substances),NASDAQ
WIRE,Encore Wire Corporation Common Stock,$60.11,0.03,0.05%,1240170465,United States,1992,115980,Capital Goods,Metal Fabrications,NASDAQ
WISA,Summit Wireless Technologies Inc. Common Stock,$3.59,-0.06,-1.64%,29900213,United States,2018,488643,Technology,Semiconductors,NASDAQ
WISH,ContextLogic Inc. Class A Common Stock,$24.75,-0.09,-0.36%,17222068982,United States,2020,2740435,Consumer Services,Catalog/Specialty Distribution,NASDAQ
WIX,Wix.com Ltd. Ordinary Shares,$249.49,0.57,0.23%,13881688966,Israel,2013,369836,Technology,Computer Software: Programming Data Processing,NASDAQ
WKEY,WISeKey International Holding AG American Depositary Shares,$6.68,-0.02,-0.30%,95970565,Switzerland,,130818,Technology,EDP Services,NASDAQ
