Symbol,Name,Last Sale,Net Change,% Change,Market Cap,Country,IPO Year,Volume,Sector,Industry,Exchange
ILPT,Industrial Logistics Properties Trust Common Shares of Beneficial Interest,$22.23,0.18,0.82%,1451643186,United States,2018,347369,Consumer Services,Real Estate Investment Trusts,NASDAQ
IMAB,I-MAB American Depositary Shares,$55.24,0.57,1.04%,3894183297,China,2020,206879,Health Care,Major Pharmaceuticals,NASDAQ
IMAC,IMAC Holdings Inc. Common Stock,$1.74,0,0.00%,20601551,United States,2019,168800,Health Care,Medical Specialities,NASDAQ
IMACW,IMAC Holdings Inc. Warrant,$0.45,0.0481,12.02%,0,United States,2019,11111,Health Care,Medical Specialities,NASDAQ
IMBI,iMedia Brands Inc. Class A Common Stock,$5.30,-0.06,-1.12%,68988860,United States,,39568,Consumer Services,Catalog/Specialty Distribution,NASDAQ
IMGN,ImmunoGen Inc. Common Stock,$7.38,-0.27,-3.53%,1436957623,United States,1989,2527279,Health Care,Major Pharmaceuticals,NASDAQ
IMKTA,Ingles Markets Incorporated Class A Common Stock,$43.42,0.17,0.39%,879679474,United States,1987,67377,Consumer Services,Food Chains,NASDAQ
IMMP,Immutep Limited American Depositary Shares,$3.20,-0.12,-3.61%,207336090,Australia,,714877,Health Care,Major Pharmaceuticals,NASDAQ
IMMR,Immersion Corporation Common Stock,$13.51,0.05,0.37%,363920289,United States,1999,459491,Technology,Computer peripheral equipment,NASDAQ
IMNM,Immunome Inc. Common Stock,$14.68,0.5,3.53%,154751114,United States,2020,36268,Health Care,Major Pharmaceuticals,NASDAQ
IMOS,ChipMOS TECHNOLOGIES INC. American Depositary Shares,$26.51,-0.015,-0.06%,963774969,Taiwan,,4050,Technology,Semiconductors,NASDAQ
IMRA,IMARA Inc. Common Stock,$14.04,-0.01,-0.07%,244400472,United States,2020,85002,Health Care,Major Pharmaceuticals,NASDAQ
IMRN,Immuron Limited American Depositary Shares,$7.28,-0.04,-0.55%,40786200,Australia,2017,33278,Health Care,Major Pharmaceuticals,NASDAQ
IMRNW,Immuron Limited Warrants,$1.27,0.1,8.55%,0,Australia,2017,15081,Health Care,Major Pharmaceuticals,NASDAQ
IMTE,Integrated Media Technology Limited Ordinary Shares,$4.20,0.13,3.19%,27357418,Australia,,173089,Consumer Non-Durables,Consumer Electronics/Appliances,NASDAQ
IMTX,Immatics N.V. Ordinary Shares,$11.18,0.03,0.27%,703318338,Germany,,81381,Health Care,Biotechnology: Biological Products (No Diagnostic Substances),NASDAQ
IMTXW,Immatics N.V. Warrants,$2.68,-0.17,-5.97%,0,Germany,,11658,Health Care,Biotechnology: Biological Products (No Diagnostic Substances),NASDAQ
IMUX,Immunic Inc. Common Stock,$17.38,0.44,2.60%,360084749,United States,2014,123652,Health Care,Major Pharmaceuticals,NASDAQ
IMV,IMV Inc. Common Shares,$3.68,0.08,2.22%,246904253,Canada,,193036,Health Care,Major Pharmaceuticals,NASDAQ
IMVT,Immunovant Inc. Common Stock,$42.19,0.58,1.39%,3451636762,United States,2019,333545,Health Care,Biotechnology: Biological Products (No Diagnostic Substances),NASDAQ
IMXI,International Money Express Inc. Common Stock,$15.12,-0.11,-0.72%,575661976,United States,2017,127666,Miscellaneous,Business Services,NASDAQ
INAQ,INSU Acquisition Corp. II Class A Common Stock,$16.30,-0.55,-3.26%,520404672,United States,2020,914163,Finance,Property-Casualty Insurers,NASDAQ
INAQU,INSU Acquisition Corp. II Unit,$17.70,-0.555,-3.04%,0,United States,2020,1122,Finance,Property-Casualty Insurers,NASDAQ
INAQW,INSU Acquisition Corp. II Warrant,$4.46,-0.11,-2.41%,0,United States,2020,69894,Finance,Property-Casualty Insurers,NASDAQ
INBK,First Internet Bancorp Common Stock,$32.49,0.81,2.56%,318420487,United States,,33995,Finance,Major Banks,NASDAQ
INBKL,First Internet Bancorp 6.0% Fixed-to-Floating Rate Subordinated Notes due 2026,$25.37,0,0.00%,0,United States,,50,Finance,Major Banks,NASDAQ
INBKZ,First Internet Bancorp 6.0% Fixed-to-Floating Rate Subordinated Notes Due 2029,$26.87,0,0.00%,0,United States,,0,Finance,Major Banks,NASDAQ
INBX,Inhibrx Inc. Common Stock,$36.42,1.29,3.67%,1373485244,United States,2020,41986,Health Care,Biotechnology: Biological Products (No Diagnostic Substances),NASDAQ
INCY,Incyte Corp. Common Stock,$97.89,3.99,4.25%,21437527250,United States,,1435185,Health Care,Biotechnology: Commercial Physical & Biological Resarch,NASDAQ
INDB,Independent Bank Corp. Common Stock,$78.08,-0.6,-0.76%,2573961231,United States,,268690,Finance,Major Banks,NASDAQ
INDT,INDUS Realty Trust Inc. (MD) Common Stock,$65.51,-3.3,-4.80%,370609854,United States,,8640,Finance,Real Estate,NASDAQ
INFI,Infinity Pharmaceuticals Inc. Common Stock,$4.09,0.27,7.07%,262605640,United States,,9335514,Health Care,Major Pharmaceuticals,NASDAQ
INFN,Infinera Corporation Common Stock,$9.73,0.08,0.83%,1878569504,United States,2007,1371364,Public Utilities,Telecommunications Equipment,NASDAQ
INGN,Inogen Inc Common Stock,$46.92,0.37,0.80%,1037759997,United States,2014,88540,Health Care,Industrial Specialties,NASDAQ
INKAU,KludeIn I Acquisition Corp. Unit,$10.61,0.06,0.57%,0,United States,2021,58744,Finance,Business Services,NASDAQ
INM,InMed Pharmaceuticals Inc. Common Shares,$4.05,-0.105,-2.53%,28352863,Canada,,26619,Health Care,Major Pharmaceuticals,NASDAQ
INMB,INmune Bio Inc. Common stock,$20.72,0.36,1.77%,278641483,United States,2019,1099240,Health Care,Biotechnology: Biological Products (No Diagnostic Substances),NASDAQ
INMD,InMode Ltd. Ordinary Shares,$59.67,1.12,1.91%,1957121223,Israel,2019,409388,Health Care,Biotechnology: Electromedical & Electrotherapeutic Apparatus,NASDAQ
INO,Inovio Pharmaceuticals Inc. Common Stock,$9.00,-0.1,-1.10%,1681663437,United States,,13490109,Health Care,Medical/Dental Instruments,NASDAQ
INOD,Innodata Inc. Common Stock,$5.50,-0.08,-1.43%,136084806,United States,1993,143994,Technology,EDP Services,NASDAQ
INOV,Inovalon Holdings Inc. Class A Common Stock,$25.93,0.39,1.53%,4029515621,United States,2015,555279,Technology,EDP Services,NASDAQ
INPX,Inpixon Common Stock,$1.62,0.22,15.71%,81289107,United States,2014,15290031,Technology,EDP Services,NASDAQ
INSE,Inspired Entertainment Inc. Common Stock,$6.55,0.28,4.47%,150843173,United States,2014,50078,Technology,Computer Software: Prepackaged Software,NASDAQ
INSG,Inseego Corp. Common Stock,$19.35,0.63,3.37%,1913333166,United States,,3325674,Capital Goods,Telecommunications Equipment,NASDAQ
INSM,Insmed Inc. Common Stock,$42.00,-0.08,-0.19%,4278443694,United States,,985580,Health Care,Major Pharmaceuticals,NASDAQ
INTC,Intel Corporation Common Stock,$56.66,-5.8,-9.29%,230209580000,United States,,85729315,Technology,Semiconductors,NASDAQ
INTG,Intergroup Corporation (The) Common Stock,$31.20,0,0.00%,71258179,United States,,0,Consumer Services,Building operators,NASDAQ
INTU,Intuit Inc. Common Stock,$374.85,-6.9,-1.81%,102726076752,United States,1993,1150622,Technology,Computer Software: Prepackaged Software,NASDAQ
INTZ,Intrusion Inc. Common Stock,$24.78,0.23,0.94%,431030234,United States,,105802,Technology,Computer Communications Equipment,NASDAQ
INVA,Innoviva Inc. Common Stock,$12.34,0.03,0.24%,1251172764,United States,,422008,Health Care,Major Pharmaceuticals,NASDAQ
INVE,Identiv Inc. Common Stock,$8.30,0.12,1.47%,149567453,United States,,177736,Technology,Computer peripheral equipment,NASDAQ
INVO,INVO BioScience Inc. Common Stock,$3.11,-0.02,-0.64%,29688358,United States,,25432,Health Care,Medical/Dental Instruments,NASDAQ
INZY,Inozyme Pharma Inc. Common Stock,$26.50,0.15,0.57%,619380366,United States,2020,19583,Health Care,Major Pharmaceuticals,NASDAQ
IONS,Ionis Pharmaceuticals Inc. Common Stock,$61.75,0.48,0.78%,8634078586,United States,,651669,Health Care,Major Pharmaceuticals,NASDAQ
IOSP,Innospec Inc. Common Stock,$96.61,1.1,1.15%,2374667424,United States,,127736,Basic Industries,Major Chemicals,NASDAQ
IOVA,Iovance Biotherapeutics Inc. Common Stock,$47.55,-0.1,-0.21%,6974982732,United States,,1083737,Health Care,Biotechnology: Biological Products (No Diagnostic Substances),NASDAQ
IPA,ImmunoPrecise Antibodies Ltd. Common Stock,$15.75,-0.3,-1.87%,263998019,Canada,,54897,Health Care,Major Pharmaceuticals,NASDAQ
IPAR,Inter Parfums Inc. Common Stock,$59.17,-2.17,-3.54%,1866077307,United States,,90511,Consumer Non-Durables,Package Goods/Cosmetics,NASDAQ
IPDN,Professional Diversity Network Inc. Common Stock,$2.59,0.13,5.29%,33203393,United States,2013,1238995,Technology,Computer Software: Programming Data Processing,NASDAQ
IPGP,IPG Photonics Corporation Common Stock,$251.00,-0.84,-0.33%,13378465660,United States,2006,358081,Technology,Semiconductors,NASDAQ
IPHA,Innate Pharma S.A. ADS,$4.49,-0.21,-4.47%,354542590,France,2019,46298,Health Care,Biotechnology: Biological Products (No Diagnostic Substances),NASDAQ
IPHI,Inphi Corporation Common Stock,$175.45,-2.68,-1.51%,9143116720,United States,2010,521011,Technology,Semiconductors,NASDAQ
IPLDP,Interstate Power & Light Company Perp Prd Ser D,$26.33,0.118,0.45%,0,United States,,1107,Public Utilities,Power Generation,NASDAQ
IPWR,Ideal Power Inc. Common Stock,$14.00,0.83,6.30%,41655432,United States,2013,1040468,Energy,Industrial Machinery/Components,NASDAQ
IQ,iQIYI Inc. American Depositary Shares,$20.62,-0.24,-1.15%,16154949984,China,2018,8660594,Consumer Services,Consumer Electronics/Video Chains,NASDAQ
IRBT,iRobot Corporation Common Stock,$98.94,2.39,2.48%,2782918822,United States,2005,679264,Consumer Durables,Consumer Electronics/Appliances,NASDAQ
IRCP,IRSA Propiedades Comerciales S.A. American Depositary Shares,$9.40,0.06,0.64%,296133013,Argentina,,8706,Consumer Services,Building operators,NASDAQ
IRDM,Iridium Communications Inc Common Stock,$49.00,0.69,1.43%,6531784378,United States,,1025930,Capital Goods,Telecommunications Equipment,NASDAQ
IRIX,IRIDEX Corporation Common Stock,$4.93,-0.46,-8.53%,68514986,United States,1996,308129,Health Care,Biotechnology: Electromedical & Electrotherapeutic Apparatus,NASDAQ
IRMD,iRadimed Corporation Common Stock,$22.94,-0.17,-0.74%,281462881,United States,2014,17814,Health Care,Medical/Dental Instruments,NASDAQ
IROQ,IF Bancorp Inc. Common Stock,$21.05,-0.09,-0.43%,68209915,United States,2011,425,Finance,Savings Institutions,NASDAQ
IRTC,iRhythm Technologies Inc. Common Stock,$252.74,0.86,0.34%,7296961680,United States,2016,233611,Health Care,Medical/Dental Instruments,NASDAQ
IRWD,Ironwood Pharmaceuticals Inc. Class A Common Stock,$10.34,0.08,0.78%,1655404159,United States,2010,2235421,Health Care,Major Pharmaceuticals,NASDAQ
ISBC,Investors Bancorp Inc. Common Stock,$11.99,0.55,4.81%,2996518774,United States,,3577813,Finance,Major Banks,NASDAQ
ISEE,IVERIC bio Inc. Common Stock,$5.31,-0.06,-1.12%,475603659,United States,2013,848142,Health Care,Major Pharmaceuticals,NASDAQ
ISIG,Insignia Systems Inc. Common Stock,$7.84,-0.72,-8.41%,13703364,United States,1991,140574,Consumer Services,Advertising,NASDAQ
ISNS,Image Sensing Systems Inc. Common Stock,$4.77,0.18,3.92%,25501808,United States,1995,87180,Capital Goods,Industrial Machinery/Components,NASDAQ
ISRG,Intuitive Surgical Inc. Common Stock,$744.08,-54.59,-6.84%,87470684535,United States,2000,1766446,Health Care,Industrial Specialties,NASDAQ
ISSC,Innovative Solutions and Support Inc. Common Stock,$6.34,0.03,0.48%,109139195,United States,2000,7775,Technology,EDP Services,NASDAQ
ISTR,Investar Holding Corporation Common Stock,$17.76,0.96,5.71%,188647928,United States,2014,25398,Finance,Major Banks,NASDAQ
ISUN,iSun Inc. Common Stock,$26.00,4.34,20.04%,159974698,United States,2016,1778080,,,NASDAQ
ITAC,Industrial Tech Acquisitions Inc. Class A common stock,$10.27,-0.025,-0.24%,99341960,United States,2020,22633,Finance,Business Services,NASDAQ
ITACU,Industrial Tech Acquisitions Inc. Unit,$11.40,0,0.00%,0,United States,2020,0,Finance,Business Services,NASDAQ
ITACW,Industrial Tech Acquisitions Inc. Warrant,$1.29,0.0123,0.96%,0,United States,2020,36413,Finance,Business Services,NASDAQ
ITCI,Intra-Cellular Therapies Inc. Common Stock,$33.32,0.635,1.94%,2670849699,United States,,488322,Health Care,Major Pharmaceuticals,NASDAQ
ITI,Iteris Inc. Common Stock,$6.80,0.05,0.74%,279985451,United States,,196411,Capital Goods,Telecommunications Equipment,NASDAQ
ITIC,Investors Title Company Common Stock,$150.49,3.83,2.61%,284788931,United States,,2107,Finance,Specialty Insurers,NASDAQ
ITMR,Itamar Medical Ltd. American Depository Shares,$25.10,-0.135,-0.54%,356031025,Israel,,1630,Health Care,Medical/Dental Instruments,NASDAQ
ITOS,iTeos Therapeutics Inc. Common Stock,$32.75,-1.17,-3.45%,1147715825,United States,2020,128200,Health Care,Biotechnology: Biological Products (No Diagnostic Substances),NASDAQ
ITRI,Itron Inc. Common Stock,$98.11,1.27,1.31%,3963340742,United States,1993,291224,Capital Goods,Electrical Products,NASDAQ
ITRM,Iterum Therapeutics plc Ordinary Share,$1.90,-0.05,-2.56%,93253953,Ireland,2018,27757804,Health Care,Major Pharmaceuticals,NASDAQ
ITRN,Ituran Location and Control Ltd. Ordinary Shares,$18.63,-0.12,-0.64%,437347280,Israel,2005,29423,Technology,Electronic Components,NASDAQ
IVA,Inventiva S.A. American Depository Shares,$18.00,-0.7,-3.74%,690815700,France,2020,7548,Health Care,Major Pharmaceuticals,NASDAQ
IVAC,Intevac Inc. Common Stock,$7.00,-0.1,-1.41%,166975361,United States,1995,188405,Technology,Industrial Machinery/Components,NASDAQ
IZEA,IZEA Worldwide Inc. Common Stock,$4.71,0.52,12.41%,228244749,United States,,5274908,Consumer Services,Advertising,NASDAQ
JACK,Jack In The Box Inc. Common Stock,$101.71,1.46,1.46%,2311150329,United States,,408915,Consumer Services,Restaurants,NASDAQ
JAGX,Jaguar Health Inc. Common Stock,$3.24,0.13,4.18%,381723846,United States,2015,25142690,Health Care,Major Pharmaceuticals,NASDAQ
JAKK,JAKKS Pacific Inc. Common Stock,$6.31,0.02,0.32%,31221363,United States,1996,147946,Consumer Non-Durables,Recreational Products/Toys,NASDAQ
JAMF,Jamf Holding Corp. Common Stock,$34.14,0.93,2.80%,3980600584,United States,2020,695426,Technology,Computer Software: Prepackaged Software,NASDAQ
JAN,JanOne Inc. Common Stock (NV),$5.52,-0.13,-2.30%,10101501,United States,,36443,Consumer Services,Home Furnishings,NASDAQ
JAQC,Jupiter Acquisition Corporation,NA,,,,United States,,0,,,NASDAQ
JAQCU,Jupiter Acquisition Corporation Units,NA,,,,United States,,0,Finance,Business Services,NASDAQ
JAQCW,Jupiter Acquisition Corporation,NA,,,,United States,,0,,,NASDAQ
JAZZ,Jazz Pharmaceuticals plc Common Stock (Ireland),$168.65,2.88,1.74%,9396167112,Ireland,2007,378395,Health Care,Major Pharmaceuticals,NASDAQ
JBHT,J.B. Hunt Transport Services Inc. Common Stock,$146.14,-1.16,-0.79%,15440275560,United States,,617062,Transportation,Trucking Freight/Courier Services,NASDAQ
JBLU,JetBlue Airways Corporation Common Stock,$15.29,0.02,0.13%,4808072743,United States,2002,4820559,Transportation,Air Freight/Delivery Services,NASDAQ
JBSS,John B. Sanfilippo & Son Inc. Common Stock,$78.47,-0.19,-0.24%,896098915,United States,1991,87703,Consumer Non-Durables,Specialty Foods,NASDAQ
JCICU,Jack Creek Investment Corp. Units,$10.44,0.44,4.40%,0,United States,2021,15407136,Finance,Business Services,NASDAQ
JCOM,j2 Global Inc. Common Stock,$97.43,0.11,0.11%,4360828742,United States,1999,248979,Technology,Telecommunications Equipment,NASDAQ
JCS,Communications Systems Inc. Common Stock,$4.84,0.07,1.47%,45111099,United States,,14146,Public Utilities,Telecommunications Equipment,NASDAQ
JCTCF,Jewett-Cameron Trading Company Common Shares,$9.86,-0.08,-0.81%,34403127,United States,,17429,Consumer Services,RETAIL: Building Materials,NASDAQ
JD,JD.com Inc. American Depositary Shares,$94.91,-0.19,-0.20%,147098826070,China,2014,6948398,Consumer Services,Other Specialty Stores,NASDAQ
JFIN,Jiayin Group Inc. American Depositary Shares,$3.70,0.05,1.37%,199892500,China,2019,137682,Finance,Finance: Consumer Services,NASDAQ
JFU,9F Inc. American Depositary Shares,$1.52,0.05,3.40%,296690320,China,2019,1072492,Finance,Finance: Consumer Services,NASDAQ
JG,Aurora Mobile Limited American Depositary Shares,$3.98,0,0.00%,460577647,China,2018,799381,Technology,Computer Software: Programming Data Processing,NASDAQ
JJSF,J & J Snack Foods Corp. Common Stock,$153.09,1.63,1.08%,2901932706,United States,1986,132516,Consumer Non-Durables,Specialty Foods,NASDAQ
JKHY,Jack Henry & Associates Inc. Common Stock,$151.50,-1.6,-1.05%,11561899755,United States,1985,934082,Technology,EDP Services,NASDAQ
JMPNL,JMP Group LLC 7.25% Senior Notes due 2027,$24.86,-0.095,-0.38%,0,United States,,8811,Finance,Investment Bankers/Brokers/Service,NASDAQ
JMPNZ,JMP Group LLC 6.875% Senior Notes due 2029,$24.10,0.2,0.84%,0,United States,,31725,Finance,Investment Bankers/Brokers/Service,NASDAQ
JNCE,Jounce Therapeutics Inc. Common Stock,$12.55,0.55,4.58%,500136011,United States,2017,807449,Health Care,Biotechnology: Biological Products (No Diagnostic Substances),NASDAQ
JOBS,51job Inc. American Depositary Shares,$68.88,-0.45,-0.65%,4642548989,China,2004,146284,Technology,Diversified Commercial Services,NASDAQ
JOUT,Johnson Outdoors Inc. Class A Common Stock,$116.60,1.69,1.47%,1177472740,United States,,17406,Consumer Non-Durables,Recreational Products/Toys,NASDAQ
JRJC,China Finance Online Co. Limited American Depositary Shares,$9.50,-0.18,-1.86%,23198620,China,2004,76552,Finance,Investment Bankers/Brokers/Service,NASDAQ
JRSH,Jerash Holdings (US) Inc. Common Stock,$5.70,-0.071,-1.23%,64552500,United States,2018,13076,Consumer Non-Durables,Apparel,NASDAQ
JRVR,James River Group Holdings Ltd. Common Shares,$47.55,-0.3,-0.63%,1455512775,Bermuda,2014,161336,Finance,Property-Casualty Insurers,NASDAQ
JSM,Navient Corporation 6% Senior Notes due December 15 2043,$24.79,-0.02,-0.08%,0,United States,,15742,Finance,Finance: Consumer Services,NASDAQ
JUPW,Jupiter Wellness Inc. Common Stock,$5.80,0.21,3.76%,53257531,United States,2020,159107,Consumer Non-Durables,Package Goods/Cosmetics,NASDAQ
JUPWW,Jupiter Wellness Inc. Warrant,$0.92,-0.0002,-0.02%,0,United States,2020,2794,Consumer Non-Durables,Package Goods/Cosmetics,NASDAQ
JVA,Coffee Holding Co. Inc. Common Stock,$5.31,-0.12,-2.21%,30312661,United States,2005,66346,Consumer Non-Durables,Food Distributors,NASDAQ
JYAC,Jiya Acquisition Corp. Class A Common Stock,$10.37,-0.12,-1.14%,142349405,United States,2020,7041,Finance,Business Services,NASDAQ
JYNT,The Joint Corp. Common Stock,$29.82,0.16,0.54%,418706974,United States,2014,184247,Miscellaneous,Multi-Sector Companies,NASDAQ
KAIRU,Kairos Acquisition Corp. Unit,$10.43,0.05,0.48%,0,United States,2021,57156,Finance,Business Services,NASDAQ
KALA,Kala Pharmaceuticals Inc. Common Stock,$7.43,-0.03,-0.40%,416524797,United States,2017,1528299,Health Care,Major Pharmaceuticals,NASDAQ
KALU,Kaiser Aluminum Corporation Common Stock,$99.61,-0.43,-0.43%,1575050154,United States,,50807,Capital Goods,Metal Fabrications,NASDAQ
KALV,KalVista Pharmaceuticals Inc. Common Stock,$16.13,0.2,1.26%,289407138,United Kingdom,2015,102090,Health Care,Major Pharmaceuticals,NASDAQ
KBAL,Kimball International Inc. Class B Common Stock,$12.63,0.07,0.56%,467025206,United States,,172459,Consumer Durables,Home Furnishings,NASDAQ
KBNT,Kubient Inc. Common Stock,$5.59,0.14,2.57%,65716649,United States,2020,463484,Technology,EDP Services,NASDAQ
KBNTW,Kubient Inc. Warrant,$2.10,0.23,12.30%,0,United States,2020,25980,Technology,EDP Services,NASDAQ
KBSF,KBS Fashion Group Limited Common Stock,$3.37,0.02,0.60%,8732678,China,2013,133112,Consumer Non-Durables,Apparel,NASDAQ
KC,Kingsoft Cloud Holdings Limited American Depositary Shares,$53.81,8.17,17.90%,11731535988,China,2020,3542170,Technology,Computer Software: Prepackaged Software,NASDAQ
KCAPL,KCAP Financial Inc. 6.125% Notes due 2022,$25.18,-0.025,-0.10%,0,United States,,682,,,NASDAQ
KDMN,Kadmon Holdings Inc. Common Stock,$4.82,-0.025,-0.52%,826692395,United States,,4960380,Health Care,Major Pharmaceuticals,NASDAQ
KDNY,Chinook Therapeutics Inc. Common Stock,$15.03,0.13,0.87%,633641233,United States,2015,108349,Health Care,Major Pharmaceuticals,NASDAQ
KDP,Keurig Dr Pepper Inc. Common Stock,$31.47,-0.07,-0.22%,44286261162,United States,,2368472,Consumer Non-Durables,Beverages (Production/Distribution),NASDAQ
KE,Kimball Electronics Inc. Common Stock,$18.12,0.29,1.63%,455596397,United States,,78514,Technology,Electrical Products,NASDAQ
KELYA,Kelly Services Inc. Class A Common Stock,$21.34,0.31,1.47%,838592858,United States,,127829,Technology,Professional Services,NASDAQ
KELYB,Kelly Services Inc. Class B Common Stock,$21.00,0.12,0.58%,825231960,United States,,2191,Technology,Professional Services,NASDAQ
KEQU,Kewaunee Scientific Corporation Common Stock,$12.75,0.11,0.87%,35225662,United States,,273,Capital Goods,Medical Specialities,NASDAQ
KERN,Akerna Corp. Common Stock,$5.74,0.06,1.06%,80696978,United States,2018,1131311,Technology,EDP Services,NASDAQ
KERNW,Akerna Corp Warrant,$1.45,0,0.00%,0,United States,2018,97458,Technology,EDP Services,NASDAQ
KFFB,Kentucky First Federal Bancorp Common Stock,$6.43,0.077,1.21%,52937367,United States,,8413,Finance,Savings Institutions,NASDAQ
KFRC,Kforce Inc. Common Stock,$45.66,1.08,2.42%,1002514521,United States,1995,81345,Technology,Professional Services,NASDAQ
KHC,The Kraft Heinz Company Common Stock,$32.91,0.13,0.40%,40236528459,United States,,4949056,Consumer Non-Durables,Packaged Foods,NASDAQ
KIDS,OrthoPediatrics Corp. Common Stock,$43.86,1.25,2.93%,857665677,United States,2017,119615,Health Care,Medical/Dental Instruments,NASDAQ
KIN,Kindred Biosciences Inc. Common Stock,$4.93,0.48,10.79%,194696221,United States,2013,1292320,Health Care,Major Pharmaceuticals,NASDAQ
KINS,Kingstone Companies Inc. Common Stock,$7.20,-0.13,-1.77%,76861426,United States,,5907,Finance,Property-Casualty Insurers,NASDAQ
KINZU,KINS Technology Group Inc. Unit,$10.70,0.03,0.28%,0,United States,2020,90127,Finance,Business Services,NASDAQ
KIRK,Kirkland's Inc. COMMONSTOCK,$28.07,3.18,12.78%,400154580,United States,2002,1644689,Consumer Services,Other Specialty Stores,NASDAQ
KLAC,KLA Corporation Common Stock,$305.01,-0.19,-0.06%,47111788783,United States,1980,725154,Capital Goods,Electronic Components,NASDAQ
KLAQU,KL Acquisition Corp Unit,$10.40,0,0.00%,0,United States,2021,377459,Finance,Business Services,NASDAQ
KLDO,Kaleido Biosciences Inc. Common Stock,$12.46,0.4,3.32%,448337028,United States,2019,134289,Health Care,Biotechnology: Biological Products (No Diagnostic Substances),NASDAQ
KLIC,Kulicke and Soffa Industries Inc. Common Stock,$37.94,-0.57,-1.48%,2353776657,Singapore,,649380,Technology,Semiconductors,NASDAQ
KLXE,KLX Energy Services Holdings Inc. Common Stock,$7.82,-0.44,-5.33%,66549123,United States,,106811,Energy,Oilfield Services/Equipment,NASDAQ
KMDA,Kamada Ltd. Ordinary Shares,$6.95,0.21,3.12%,310963593,Israel,2013,129240,Health Care,Major Pharmaceuticals,NASDAQ
KMPH,KemPharm Inc. Common Stock,$6.02,-0.02,-0.33%,70137720,United States,,525398,Health Care,Major Pharmaceuticals,NASDAQ
KNDI,Kandi Technologies Group Inc Common Stock,$8.18,-0.13,-1.56%,592048400,China,,3616927,Capital Goods,Auto Manufacturing,NASDAQ
KNSA,Kiniksa Pharmaceuticals Ltd. Class A Common Stock,$18.27,0.8,4.58%,1243730889,United States,2018,320941,Health Care,Major Pharmaceuticals,NASDAQ
KNSL,Kinsale Capital Group Inc. Common Stock,$191.82,0.24,0.13%,4349918061,United States,2016,167324,Finance,Property-Casualty Insurers,NASDAQ
KNTE,Kinnate Biopharma Inc. Common Stock,$37.20,-0.77,-2.03%,1611772547,United States,2020,91081,Health Care,Major Pharmaceuticals,NASDAQ
KOD,Kodiak Sciences Inc Common Stock,$164.33,6.31,3.99%,8343965687,United States,2018,171831,Health Care,Biotechnology: Biological Products (No Diagnostic Substances),NASDAQ
KOPN,Kopin Corporation Common Stock,$4.48,0.63,16.36%,381037619,United States,1992,7382508,Technology,Semiconductors,NASDAQ
KOR,Corvus Gold Inc. Common Shares,$2.28,0.005,0.22%,288089722,Canada,,181635,Basic Industries,Precious Metals,NASDAQ
KOSS,Koss Corporation Common Stock,$3.34,-0.2,-5.65%,24732136,United States,,121833,Consumer Non-Durables,Consumer Electronics/Appliances,NASDAQ
KPTI,Karyopharm Therapeutics Inc. Common Stock,$15.09,0.03,0.20%,1110635725,United States,2013,1725732,Health Care,Major Pharmaceuticals,NASDAQ
KRBP,Kiromic BioPharma Inc. Common Stock,$9.23,-0.27,-2.84%,67683581,United States,2020,21696,Health Care,Biotechnology: Biological Products (No Diagnostic Substances),NASDAQ
KRKR,36Kr Holdings Inc. American Depositary Shares,$5.30,0.1,1.92%,198720002,China,2019,437040,Miscellaneous,Business Services,NASDAQ
KRMD,Repro Med Systems Inc. Common Stock,$5.18,0.02,0.39%,227624160,United States,,139084,Health Care,Medical/Dental Instruments,NASDAQ
KRNT,Kornit Digital Ltd. Ordinary Shares,$97.95,0.45,0.46%,4434973048,Israel,2015,181820,Capital Goods,Industrial Machinery/Components,NASDAQ
KRNY,Kearny Financial Corp Common Stock,$10.77,0.02,0.19%,964027557,United States,,354145,Finance,Savings Institutions,NASDAQ
KRON,Kronos Bio Inc. Common Stock,$32.48,0.76,2.40%,1819968210,United States,2020,94160,Health Care,Major Pharmaceuticals,NASDAQ
KROS,Keros Therapeutics Inc. Common Stock,$67.15,2.86,4.45%,1556426270,United States,2020,190302,Health Care,Major Pharmaceuticals,NASDAQ
KRTX,Karuna Therapeutics Inc. Common Stock,$103.07,2.74,2.73%,2762952758,United States,2019,98931,Health Care,Major Pharmaceuticals,NASDAQ
KRUS,Kura Sushi USA Inc. Class A Common Stock,$23.65,0.12,0.51%,197990374,United States,2019,29939,Consumer Services,Restaurants,NASDAQ
KRYS,Krystal Biotech Inc. Common Stock,$71.18,1.56,2.24%,1402788392,United States,2017,106599,Health Care,Biotechnology: Biological Products (No Diagnostic Substances),NASDAQ
KSMT,Kismet Acquisition One Corp Ordinary Shares,$10.29,-0.035,-0.34%,326548750,Russia,2020,20951,Finance,Business Services,NASDAQ
KSMTU,Kismet Acquisition One Corp Unit,$11.10,-0.1,-0.89%,0,Russia,2020,4205,Finance,Business Services,NASDAQ
KSMTW,Kismet Acquisition One Corp Warrant,$1.25,0,0.00%,0,Russia,,37002,Finance,Business Services,NASDAQ
