Symbol,Name,Last Sale,Net Change,% Change,Market Cap,Country,IPO Year,Volume,Sector,Industry,Exchange
AACG,ATA Creativity Global American Depositary Shares,$1.35,-0.05,-3.57%,42323176,China,,80833,Consumer Services,Other Consumer Services,NASDAQ
AACQ,Artius Acquisition Inc. Class A Common Stock,$11.03,0.07,0.64%,998904375,United States,2020,1083599,Finance,Business Services,NASDAQ
AACQU,Artius Acquisition Inc. Unit,$11.87,0.04,0.34%,0,United States,2020,112227,Finance,Business Services,NASDAQ
AACQW,Artius Acquisition Inc Warrant,$2.56,-0.02,-0.78%,0,United States,2020,415315,Finance,Business Services,NASDAQ
AAL,American Airlines Group Inc. Common Stock,$15.82,-0.01,-0.06%,9662441674,United States,,39126567,Transportation,Air Freight/Delivery Services,NASDAQ
AAME,Atlantic American Corporation Common Stock,$2.40,-0.05,-2.04%,48994270,United States,,8466,Finance,Life Insurance,NASDAQ
AAOI,Applied Optoelectronics Inc. Common Stock,$10.47,-0.02,-0.19%,240561296,United States,2013,489676,Technology,Semiconductors,NASDAQ
AAON,AAON Inc. Common Stock,$72.74,1.09,1.52%,3800089990,United States,,162748,Capital Goods,Industrial Machinery/Components,NASDAQ
AAPL,Apple Inc. Common Stock,$139.07,2.2,1.61%,2411103873800,United States,1980,114459360,Technology,Computer Manufacturing,NASDAQ
AAWW,Atlas Air Worldwide Holdings NEW Common Stock,$53.56,1.3,2.49%,1473826427,United States,,273228,Transportation,Transportation Services,NASDAQ
AAXN,Axon Enterprise Inc. Common Stock,$170.26,7.72,4.75%,10820005633,United States,,654239,Capital Goods,Ordnance And Accessories,NASDAQ
ABCB,Ameris Bancorp Common Stock,$44.32,1.37,3.19%,3079820999,United States,1994,400602,Finance,Major Banks,NASDAQ
ABCL,AbCellera Biologics Inc. Common Shares,$50.50,-0.4,-0.79%,13593982284,Canada,2020,694532,Health Care,Major Pharmaceuticals,NASDAQ
ABCM,Abcam plc American Depositary Shares,$23.59,0.27,1.16%,5347043887,United Kingdom,2020,80553,Health Care,Biotechnology: Biological Products (No Diagnostic Substances),NASDAQ
ABEO,Abeona Therapeutics Inc. Common Stock,$2.12,0.14,7.07%,208878773,United States,,2337194,Health Care,Major Pharmaceuticals,NASDAQ
ABIO,ARCA biopharma Inc. Common Stock,$4.66,0.01,0.22%,43438050,United States,,809796,Health Care,Biotechnology: In Vitro & In Vivo Diagnostic Substances,NASDAQ
ABMD,ABIOMED Inc. Common Stock,$347.90,-0.66,-0.19%,15721560296,United States,,174368,Health Care,Medical/Dental Instruments,NASDAQ
ABNB,Airbnb Inc. Class A Common Stock,$181.87,1.47,0.82%,108467087403,United States,2020,7136811,Finance,Diversified Commercial Services,NASDAQ
ABST,Absolute Software Corporation Common Stock,$13.29,-0.05,-0.38%,648256803,Canada,2020,56742,Technology,Computer Software: Prepackaged Software,NASDAQ
ABTX,Allegiance Bancshares Inc. Common Stock,$36.47,0.56,1.56%,745720690,United States,2015,98618,Finance,Major Banks,NASDAQ
ABUS,Arbutus Biopharma Corporation Common Stock,$4.05,0.09,2.27%,343882495,Canada,,1671328,Health Care,Major Pharmaceuticals,NASDAQ
ACAC,Acies Acquisition Corp. Class A Ordinary Share,$11.15,-0.19,-1.68%,300004688,United States,2020,42675,Finance,Business Services,NASDAQ
ACACU,Acies Acquisition Corp. Unit,$11.76,-0.34,-2.81%,0,United States,2020,34606,Finance,Business Services,NASDAQ
ACACW,Acies Acquisition Corp. Warrant,$2.24,-0.14,-5.88%,0,United States,2020,84257,Finance,Business Services,NASDAQ
ACAD,ACADIA Pharmaceuticals Inc. Common Stock,$52.83,0.82,1.58%,8398812336,United States,2004,563000,Health Care,Major Pharmaceuticals,NASDAQ
ACBI,Atlantic Capital Bancshares Inc. Common Stock,$17.52,0.52,3.06%,357318858,United States,,87073,Finance,Major Banks,NASDAQ
ACCD,Accolade Inc. Common Stock,$59.09,0.27,0.46%,3268928467,United States,2020,1006643,,,NASDAQ
ACER,Acer Therapeutics Inc. Common Stock (DE),$3.67,-0.05,-1.34%,51079941,United States,,591342,Health Care,Major Pharmaceuticals,NASDAQ
ACET,Adicet Bio Inc. Common Stock,$14.54,0.04,0.28%,284836099,United States,2018,42333,Health Care,Major Pharmaceuticals,NASDAQ
ACEV,ACE Convergence Acquisition Corp. Class A Ordinary Shares,$11.19,-0.11,-0.97%,321712500,United States,2020,968346,Finance,Business Services,NASDAQ
ACEVU,ACE Convergence Acquisition Corp. Unit,$12.51,-0.15,-1.19%,0,United States,2020,3898,Finance,Business Services,NASDAQ
ACEVW,ACE Convergence Acquisition Corp. Warrant,$2.65,-0.05,-1.85%,0,United States,2020,208230,Finance,Business Services,NASDAQ
ACGL,Arch Capital Group Ltd. Common Stock,$33.31,-1.06,-3.08%,13524745047,Bermuda,,4254841,Finance,Property-Casualty Insurers,NASDAQ
ACGLO,Arch Capital Group Ltd. Depositary Shares Each Representing 1/1000th Interest in a Share of 5.45% Non-Cumulative Preferred Shares Series F,$26.70,0.27,1.02%,0,Bermuda,,10496,Finance,Property-Casualty Insurers,NASDAQ
ACGLP,Arch Capital Group Ltd. Depositary Shares Representing Interest in 5.25% Non-Cumulative Preferred Series E Shrs,$25.59,0.07,0.27%,0,Bermuda,,15135,Finance,Property-Casualty Insurers,NASDAQ
ACHC,Acadia Healthcare Company Inc. Common Stock,$52.01,0.42,0.81%,4628435017,United States,,463473,Health Care,Medical Specialities,NASDAQ
ACHV,Achieve Life Sciences Inc. Common Shares,$11.78,-0.77,-6.14%,71742132,United States,,1096699,Health Care,Biotechnology: In Vitro & In Vivo Diagnostic Substances,NASDAQ
ACIA,Acacia Communications Inc. Common Stock,$114.48,0.02,0.02%,4849804848,United States,2016,597390,Technology,Semiconductors,NASDAQ
ACIU,AC Immune SA Common Stock,$6.33,0.3,4.98%,454122334,Switzerland,2016,216963,Health Care,Major Pharmaceuticals,NASDAQ
ACIW,ACI Worldwide Inc. Common Stock,$40.30,-0.2,-0.49%,4705489699,United States,,716671,Technology,Computer Software: Prepackaged Software,NASDAQ
ACKIU,Ackrell SPAC Partners I Co. Units,$10.47,-0.0293,-0.28%,0,United States,2020,12051,Finance,Business Services,NASDAQ
ACLS,Axcelis Technologies Inc. Common Stock,$40.09,0.16,0.40%,1342854881,United States,2000,385458,Technology,Industrial Machinery/Components,NASDAQ
ACMR,ACM Research Inc. Class A Common Stock,$97.60,-1.66,-1.67%,1802166822,United States,2017,144771,Technology,Industrial Machinery/Components,NASDAQ
ACNB,ACNB Corporation Common Stock,$27.17,0.57,2.14%,236469014,United States,,22926,Finance,Major Banks,NASDAQ
ACOR,Acorda Therapeutics Inc. Common Stock,$7.60,0.38,5.26%,72072594,United States,2006,523963,Health Care,Biotechnology: Biological Products (No Diagnostic Substances),NASDAQ
ACRS,Aclaris Therapeutics Inc. Common Stock,$18.22,0.18,1.00%,820454999,United States,2015,1394749,Health Care,Major Pharmaceuticals,NASDAQ
ACRX,AcelRx Pharmaceuticals Inc. Common Stock,$1.91,0,0.00%,189683907,United States,2011,6367054,Health Care,Major Pharmaceuticals,NASDAQ
ACST,Acasti Pharma Inc. Class A Common Stock,$0.80,-0.0348,-4.17%,77514030,Canada,,37039074,Health Care,Major Pharmaceuticals,NASDAQ
ACTC,ArcLight Clean Transition Corp. Class A Ordinary Shares,$25.65,-0.16,-0.62%,889734375,United States,2020,3500825,Finance,Business Services,NASDAQ
ACTCU,ArcLight Clean Transition Corp. Unit,$29.96,0.03,0.10%,0,United States,2020,48057,Finance,Business Services,NASDAQ
ACTCW,ArcLight Clean Transition Corp. Warrant,$8.70,0.32,3.82%,0,United States,2020,663191,Finance,Business Services,NASDAQ
ACTG,Acacia Research Corporation (Acacia Tech) Common Stock,$5.74,-0.365,-5.98%,282864060,United States,,1538907,Miscellaneous,Multi-Sector Companies,NASDAQ
ADAP,Adaptimmune Therapeutics plc American Depositary Shares,$5.60,0.18,3.32%,866761078,United Kingdom,2015,577920,Health Care,Biotechnology: Biological Products (No Diagnostic Substances),NASDAQ
ADBE,Adobe Inc. Common Stock,$472.44,0.42,0.09%,226157028000,United States,1986,2534274,Technology,Computer Software: Prepackaged Software,NASDAQ
ADERU,26 Capital Acquisition Corp. Unit,$10.70,0.09,0.85%,0,United States,2021,453898,Finance,Business Services,NASDAQ
ADES,Advanced Emissions Solutions Inc. Common Stock,$5.38,0.05,0.94%,99787632,United States,,71296,Basic Industries,Major Chemicals,NASDAQ
ADI,Analog Devices Inc. Common Stock,$155.58,-3.71,-2.33%,57471806176,United States,,3147156,Technology,Semiconductors,NASDAQ
ADIL,Adial Pharmaceuticals Inc Common Stock,$2.22,-0.03,-1.33%,31952682,United States,2018,573976,Health Care,Major Pharmaceuticals,NASDAQ
ADILW,Adial Pharmaceuticals Inc Warrant,$2.23,1.735,350.51%,0,United States,2018,18111,Health Care,Major Pharmaceuticals,NASDAQ
ADMA,ADMA Biologics Inc Common Stock,$2.43,0.01,0.41%,229751766,United States,,2757542,Health Care,Biotechnology: Biological Products (No Diagnostic Substances),NASDAQ
ADMP,Adamis Pharmaceuticals Corporation Common Stock,$1.79,0.52,40.95%,167647154,United States,,207315027,Health Care,Major Pharmaceuticals,NASDAQ
ADMS,Adamas Pharmaceuticals Inc. Common Stock,$4.72,0.21,4.66%,134616850,United States,2014,163416,Health Care,Major Pharmaceuticals,NASDAQ
ADOC,Edoc Acquisition Corp. Class A Ordinary Share,$10.29,-0.0053,-0.05%,124993100,United States,2020,7223,Finance,Business Services,NASDAQ
ADOCR,Edoc Acquisition Corp. Right,$0.49,-0.0001,-0.02%,0,United States,2020,115159,Finance,Business Services,NASDAQ
ADOCW,Edoc Acquisition Corp. Warrant,$0.72,-0.035,-4.67%,0,United States,2020,71053,Finance,Business Services,NASDAQ
ADP,Automatic Data Processing Inc. Common Stock,$161.98,0.95,0.59%,69459291558,United States,,1894998,Technology,EDP Services,NASDAQ
ADPT,Adaptive Biotechnologies Corporation Common Stock,$67.74,0.73,1.09%,9264963528,United States,2019,293229,Health Care,Biotechnology: Biological Products (No Diagnostic Substances),NASDAQ
ADSK,Autodesk Inc. Common Stock,$299.17,-7.29,-2.38%,65784312696,United States,,2590522,Technology,Computer Software: Prepackaged Software,NASDAQ
ADTN,ADTRAN Inc. Common Stock,$17.51,0.37,2.16%,839713412,United States,1994,232489,Public Utilities,Telecommunications Equipment,NASDAQ
ADTX,ADiTx Therapeutics Inc. Common Stock,$3.60,-0.2,-5.26%,44206891,United States,2020,5561629,Health Care,Major Pharmaceuticals,NASDAQ
ADUS,Addus HomeCare Corporation Common Stock,$127.80,3.4,2.73%,2020352882,United States,2009,74892,Health Care,Medical/Nursing Services,NASDAQ
ADV,Advantage Solutions Inc. Class A Common Stock,$11.22,-0.17,-1.49%,3516630542,United States,2019,112456,Miscellaneous,Business Services,NASDAQ
ADVM,Adverum Biotechnologies Inc. Common Stock,$13.39,-0.03,-0.22%,1305225104,United States,2014,647338,Health Care,Biotechnology: Biological Products (No Diagnostic Substances),NASDAQ
ADVWW,Advantage Solutions Inc. Warrant,$2.05,-0.102,-4.74%,0,United States,2019,47743,Miscellaneous,Business Services,NASDAQ
ADXN,Addex Therapeutics Ltd American Depositary Shares,$12.12,-0.82,-6.34%,68312174,Switzerland,,299636,Health Care,Major Pharmaceuticals,NASDAQ
ADXS,Advaxis Inc. Common Stock,$0.75,-0.0446,-5.65%,81861089,United States,,11544823,Health Care,Major Pharmaceuticals,NASDAQ
AEACU,Authentic Equity Acquisition Corp. Unit,$10.43,-0.02,-0.19%,0,United States,2021,481835,Finance,Business Services,NASDAQ
AEGN,Aegion Corp Common Stock,$20.63,0.27,1.33%,634843937,United States,,76527,Basic Industries,Water Supply,NASDAQ
AEHL,Antelope Enterprise Holdings Limited Common Stock (0.024 par),$2.80,0.04,1.45%,8540252,China,,259057,Capital Goods,Building Materials,NASDAQ
AEHR,Aehr Test Systems Common Stock,$2.40,-0.04,-1.64%,56379667,United States,1997,67799,Capital Goods,Electrical Products,NASDAQ
AEIS,Advanced Energy Industries Inc. Common Stock,$118.83,-1.26,-1.05%,4547946723,United States,1995,250081,Capital Goods,Industrial Machinery/Components,NASDAQ
AEMD,Aethlon Medical Inc. Common Stock,$2.64,-0.06,-2.22%,31913146,United States,,435552,Health Care,Medical/Dental Instruments,NASDAQ
AEP,American Electric Power Company Inc. Common Stock,$82.08,1.11,1.37%,40743652951,United States,,3789461,Public Utilities,Electric Utilities: Central,NASDAQ
AEPPL,American Electric Power Company Inc. Corporate Unit,$48.47,0.1,0.21%,0,United States,,563025,Public Utilities,Electric Utilities: Central,NASDAQ
AEPPZ,American Electric Power Company Inc. Corporate Units,$50.03,0.64,1.30%,0,United States,,651727,Public Utilities,Electric Utilities: Central,NASDAQ
AERI,Aerie Pharmaceuticals Inc. Common Stock,$16.81,0.31,1.88%,786956670,United States,2013,878671,Health Care,Biotechnology: Biological Products (No Diagnostic Substances),NASDAQ
AESE,Allied Esports Entertainment Inc. Common Stock,$1.75,0.05,2.94%,61443975,United States,2017,5857862,Consumer Services,Services-Misc. Amusement & Recreation,NASDAQ
AEY,ADDvantage Technologies Group Inc. Common Stock,$3.04,-0.09,-2.88%,36575395,United States,,207088,Consumer Services,Office Equipment/Supplies/Services,NASDAQ
AEYE,AudioEye Inc. Common Stock,$24.90,0.23,0.93%,249501187,United States,,77708,Technology,Computer Software: Prepackaged Software,NASDAQ
AEZS,Aeterna Zentaris Inc. Common Stock,$0.71,-0.0613,-7.97%,44357654,Canada,,11539019,Health Care,Major Pharmaceuticals,NASDAQ
AFBI,Affinity Bancshares Inc. Common Stock (MD),$10.81,-0.04,-0.37%,0,United States,2017,239216,,,NASDAQ
AFIB,Acutus Medical Inc. Common Stock,$25.95,-0.05,-0.19%,722605854,United States,2020,138170,Health Care,Medical/Dental Instruments,NASDAQ
AFIN,American Finance Trust Inc. Class A Common Stock,$7.82,-0.12,-1.51%,851106974,United States,,653208,Consumer Services,Real Estate Investment Trusts,NASDAQ
AFINO,American Finance Trust Inc. 7.375% Series C Cumulative Redeemable Preferred Stock,$25.00,0.05,0.20%,,United States,,9055,Consumer Services,Real Estate Investment Trusts,NASDAQ
AFINP,American Finance Trust Inc. 7.50% Series A Cumulative Redeemable Perpetual Preferred Stock,$25.27,-0.04,-0.16%,0,United States,,10407,Consumer Services,Real Estate Investment Trusts,NASDAQ
AFMD,Affimed N.V.,$6.52,-0.06,-0.91%,748406950,Germany,2014,1536106,Health Care,Major Pharmaceuticals,NASDAQ
AFRM,Affirm Holdings Inc. Class A Common Stock,$119.95,10.98,10.08%,29117475181,United States,2021,4343451,Miscellaneous,Business Services,NASDAQ
AFYA,Afya Limited Class A Common Shares,$23.47,-0.48,-2.00%,2187470256,Brazil,2019,238528,Consumer Services,Other Consumer Services,NASDAQ
AGBA,AGBA Acquisition Limited Ordinary Share,$10.64,0.045,0.43%,63544125,Hong Kong,2019,14591,Finance,Business Services,NASDAQ
AGBAR,AGBA Acquisition Limited Right,$0.40,0.0193,5.07%,0,Hong Kong,2019,23808,Finance,Business Services,NASDAQ
AGBAU,AGBA Acquisition Limited Unit,$11.40,0,0.00%,0,Hong Kong,2019,0,Finance,Business Services,NASDAQ
AGBAW,AGBA Acquisition Limited Warrant,$0.52,-0.028,-5.11%,0,Hong Kong,2019,81657,Finance,Business Services,NASDAQ
AGC,Altimeter Growth Corp. Class A Ordinary Shares,$16.75,0.25,1.52%,1046875000,United States,2020,503993,Finance,Business Services,NASDAQ
AGCUU,Altimeter Growth Corp. Unit,$18.00,0.77,4.47%,0,United States,2020,119020,Finance,Business Services,NASDAQ
AGCWW,Altimeter Growth Corp. Warrant,$6.03,0.23,3.97%,0,United States,2020,62221,Finance,Business Services,NASDAQ
AGEN,Agenus Inc. Common Stock,$3.44,0.02,0.59%,654113595,United States,2000,1314841,Health Care,Biotechnology: Biological Products (No Diagnostic Substances),NASDAQ
AGFS,AgroFresh Solutions Inc. Common Stock,$2.03,0.02,1.00%,107701569,United States,2014,110042,Basic Industries,Agricultural Chemicals,NASDAQ
AGFY,Agrify Corporation,NA,,,,United States,,0,,,NASDAQ
AGIO,Agios Pharmaceuticals Inc. Common Stock,$47.47,-0.28,-0.59%,3287763513,United States,2013,550081,Health Care,Major Pharmaceuticals,NASDAQ
AGLE,Aeglea BioTherapeutics Inc. Common Stock,$7.63,0.19,2.55%,365760126,United States,2016,345063,Health Care,Major Pharmaceuticals,NASDAQ
AGMH,AGM Group Holdings Inc. Class A Ordinary Shares,$15.86,0.73,4.83%,458212132,Hong Kong,2018,5944,Technology,EDP Services,NASDAQ
AGNC,AGNC Investment Corp. Common Stock,$16.14,0.055,0.34%,8799714724,United States,2008,5074646,Consumer Services,Real Estate Investment Trusts,NASDAQ
AGNCM,AGNC Investment Corp. Depositary Shares rep 6.875% Series D Fixed-to-Floating Cumulative Redeemable Preferred Stock,$25.03,0.28,1.13%,0,United States,,27297,Consumer Services,Real Estate Investment Trusts,NASDAQ
AGNCN,AGNC Investment Corp. Depositary Shares Each Representing a 1/1000th Interest in a Share of 7.00% Series C Fixed-To-Floating Rate Cumulative Redeemable Preferred Stock,$25.66,0.15,0.59%,0,United States,,32437,Consumer Services,Real Estate Investment Trusts,NASDAQ
AGNCO,AGNC Investment Corp. Depositary Shares each representing a 1/1000th interest in a share of 6.50% Series E Fixed-to-Floating Cumulative Redeemable Preferred Stock,$24.90,0.16,0.65%,0,United States,,29860,Consumer Services,Real Estate Investment Trusts,NASDAQ
AGNCP,AGNC Investment Corp. Depositary Shares Each Representing a 1/1000th Interest in a Share of 6.125% Series F Fixed-to-Floating Rate Cumulative Redeemable Preferred Stock,$24.28,-0.07,-0.29%,0,United States,,43519,Consumer Services,Real Estate Investment Trusts,NASDAQ
AGRX,Agile Therapeutics Inc. Common Stock,$2.94,-0.03,-1.01%,257544000,United States,2014,839154,Health Care,Major Pharmaceuticals,NASDAQ
AGTC,Applied Genetic Technologies Corporation Common Stock,$4.74,0.06,1.28%,122716823,United States,2014,149455,Health Care,Biotechnology: Biological Products (No Diagnostic Substances),NASDAQ
AGYS,Agilysys Inc. Common Stock,$44.88,1.66,3.84%,1058773639,United States,,171775,Technology,EDP Services,NASDAQ
AHAC,Alpha Healthcare Acquisition Corp. Class A Common Stock,$10.22,0.01,0.10%,131313825,United States,2020,25258,Finance,Business Services,NASDAQ
AHACU,Alpha Healthcare Acquisition Corp. Unit,$10.80,0.04,0.37%,0,United States,2020,35905,Finance,Business Services,NASDAQ
AHACW,Alpha Healthcare Acquisition Corp. Warrant,$1.51,-0.0299,-1.94%,0,United States,2020,16300,Finance,Business Services,NASDAQ
AHCO,AdaptHealth Corp. Class A Common Stock,$38.00,-0.1,-0.26%,3681444256,United States,2018,885942,Health Care,Medical/Nursing Services,NASDAQ
AHPI,Allied Healthcare Products Inc. Common Stock,$6.65,-0.22,-3.20%,26690021,United States,1992,860409,Health Care,Industrial Specialties,NASDAQ
AIH,Aesthetic Medical International Holdings Group Ltd. American Depositary Shares,$5.08,0.09,1.80%,119953481,China,2019,103530,Health Care,Medical Specialities,NASDAQ
AIHS,Senmiao Technology Limited Common Stock,$1.49,-0.1,-6.29%,64604639,China,2018,2835828,Finance,Finance: Consumer Services,NASDAQ
AIKI,AIkido Pharma Inc. Common Stock,$1.24,0.03,2.48%,43301072,United States,,8142418,Health Care,Biotechnology: Commercial Physical & Biological Resarch,NASDAQ
AIMC,Altra Industrial Motion Corp. Common Stock,$56.43,-0.25,-0.44%,3651812261,United States,2006,222423,Capital Goods,Industrial Machinery/Components,NASDAQ
AINV,Apollo Investment Corporation Common Stock,$12.31,0.01,0.08%,803340457,United States,2004,361400,,,NASDAQ
AIRG,Airgain Inc. Common Stock,$22.73,-1.04,-4.38%,222025663,United States,2016,187523,Technology,Radio And Television Broadcasting And Communications Equipment,NASDAQ
AIRT,Air T Inc. Common Stock,$22.57,0.55,2.50%,65043422,United States,,23647,Transportation,Air Freight/Delivery Services,NASDAQ
AIRTP,Air T Inc. Air T Funding Alpha Income Trust Preferred Securities,$25.20,-1.55,-5.79%,0,United States,,1497,Transportation,Air Freight/Delivery Services,NASDAQ
AIRTW,Air T Inc. Air T Funding Warrants to Purchase Alpha Income Trust Preferred Expiring 08/30/2021,$0.19,0.0152,8.57%,0,United States,,146278,Transportation,Air Freight/Delivery Services,NASDAQ
AKAM,Akamai Technologies Inc. Common Stock,$109.06,-0.89,-0.81%,17754312331,United States,1999,1416540,Miscellaneous,Business Services,NASDAQ
AKBA,Akebia Therapeutics Inc. Common Stock,$3.36,0.21,6.67%,485650684,United States,2014,6565382,Health Care,Major Pharmaceuticals,NASDAQ
AKER,Akers Biosciences Inc. Common Stock,$2.85,0.16,5.95%,53083533,United States,2014,436188,Health Care,Biotechnology: In Vitro & In Vivo Diagnostic Substances,NASDAQ
AKICU,Sports Ventures Acquisition Corp. Unit,$10.49,-0.02,-0.19%,0,United States,2021,144321,Finance,Business Services,NASDAQ
AKRO,Akero Therapeutics Inc. Common Stock,$31.06,1.17,3.91%,1078460506,United States,2019,182295,Health Care,Major Pharmaceuticals,NASDAQ
AKTS,Akoustis Technologies Inc. Common Stock,$15.37,0.25,1.65%,593709501,United States,,687472,Public Utilities,Telecommunications Equipment,NASDAQ
AKTX,Akari Therapeutics plc ADR (0.01 USD),$2.94,0.01,0.34%,113111558,United Kingdom,,272794,Health Care,Major Pharmaceuticals,NASDAQ
AKU,Akumin Inc. Common Shares,$3.08,0.14,4.76%,216149558,Canada,,1287485,Health Care,Medical Specialities,NASDAQ
AKUS,Akouos Inc. Common Stock,$16.95,0.02,0.12%,582786172,United States,2020,156772,Health Care,Major Pharmaceuticals,NASDAQ
ALAC,Alberton Acquisition Corporation Ordinary Shares,$14.40,-0.77,-5.08%,66459427,Hong Kong,2018,161213,Finance,Business Services,NASDAQ
ALACR,Alberton Acquisition Corporation Rights exp April 26 2021,$0.82,-0.0286,-3.36%,0,Hong Kong,2018,224212,Finance,Business Services,NASDAQ
ALACU,Alberton Acquisition Corporation Unit,$15.50,0,0.00%,0,Hong Kong,2018,0,Finance,Business Services,NASDAQ
ALACW,Alberton Acquisition Corporation Warrant,$1.41,-0.04,-2.76%,0,Hong Kong,2018,305065,Finance,Business Services,NASDAQ
ALBO,Albireo Pharma Inc. Common Stock,$35.06,0.18,0.52%,668848280,United States,,101061,Health Care,Major Pharmaceuticals,NASDAQ
ALCO,Alico Inc. Common Stock,$30.94,-0.08,-0.26%,232464998,United States,,29685,Consumer Non-Durables,Farming/Seeds/Milling,NASDAQ
ALDX,Aldeyra Therapeutics Inc. Common Stock,$12.29,0.5,4.24%,561191547,United States,2014,1233021,Health Care,Major Pharmaceuticals,NASDAQ
ALEC,Alector Inc. Common Stock,$16.59,0.38,2.34%,1314636542,United States,2019,487775,Health Care,Biotechnology: Biological Products (No Diagnostic Substances),NASDAQ
ALGM,Allegro MicroSystems Inc. Common Stock,$33.50,-0.6,-1.76%,6345964161,United States,2020,448015,Technology,Semiconductors,NASDAQ
ALGN,Align Technology Inc. Common Stock,$534.08,-9.73,-1.79%,42112417359,United States,2001,690685,Health Care,Industrial Specialties,NASDAQ
ALGS,Aligos Therapeutics Inc. Common Stock,$32.85,-1.35,-3.95%,1252173344,United States,2020,75105,Health Care,Biotechnology: Biological Products (No Diagnostic Substances),NASDAQ
ALGT,Allegiant Travel Company Common Stock,$191.42,1.17,0.62%,3137274453,United States,2006,85200,Transportation,Air Freight/Delivery Services,NASDAQ
ALIM,Alimera Sciences Inc. Common Stock,$8.00,-0.68,-7.83%,45754936,United States,2010,56853,Health Care,Major Pharmaceuticals,NASDAQ
ALJJ,ALJ Regional Holdings Inc. Common Stock,$1.28,-0.07,-5.19%,54170941,United States,,73140,Miscellaneous,Business Services,NASDAQ
ALKS,Alkermes plc Ordinary Shares,$22.19,0.72,3.35%,3531533729,Ireland,1991,1784544,Health Care,Major Pharmaceuticals,NASDAQ
ALLK,Allakos Inc. Common Stock,$132.33,3.7,2.88%,6947767776,United States,2018,285572,Health Care,Major Pharmaceuticals,NASDAQ
ALLO,Allogene Therapeutics Inc. Common Stock,$30.76,-0.58,-1.85%,4315017476,United States,2018,458511,Health Care,Biotechnology: Biological Products (No Diagnostic Substances),NASDAQ
ALLT,Allot Ltd. Ordinary Shares,$14.57,0.24,1.68%,513046256,Israel,2006,286182,Technology,Computer Communications Equipment,NASDAQ
ALNA,Allena Pharmaceuticals Inc. Common Stock,$1.68,0.05,3.07%,84421596,United States,2017,1205166,Health Care,Biotechnology: Biological Products (No Diagnostic Substances),NASDAQ
ALNY,Alnylam Pharmaceuticals Inc. Common Stock,$172.38,5.63,3.38%,20027240788,United States,2004,534971,Health Care,Major Pharmaceuticals,NASDAQ
ALOT,AstroNova Inc. Common Stock,$10.53,0.05,0.48%,75505218,United States,1983,4369,Technology,Computer peripheral equipment,NASDAQ
ALPN,Alpine Immune Sciences Inc. Common Stock,$13.12,0.22,1.71%,312297761,United States,2015,94389,Health Care,Major Pharmaceuticals,NASDAQ
ALRM,Alarm.com Holdings Inc. Common Stock,$97.00,1.41,1.48%,4763870887,United States,2015,418859,Technology,Computer Software: Prepackaged Software,NASDAQ
ALRN,Aileron Therapeutics Inc. Common Stock,$1.98,-0.075,-3.65%,165548099,United States,2017,2853520,Health Care,Major Pharmaceuticals,NASDAQ
ALRS,Alerus Financial Corporation Common Stock,$28.48,0.79,2.85%,487630658,United States,2019,47390,Finance,Major Banks,NASDAQ
ALSK,Alaska Communications Systems Group Inc. Common Stock,$3.29,0.01,0.31%,177076140,United States,1999,1049419,Public Utilities,Telecommunications Equipment,NASDAQ
ALT,Altimmune Inc. Common Stock,$14.35,1.44,11.15%,533001275,United States,,2341566,Health Care,Major Pharmaceuticals,NASDAQ
ALTA,Altabancorp Common Stock,$33.00,0.8,2.48%,620512794,United States,2015,49462,Finance,Major Banks,NASDAQ
ALTM,Altus Midstream Company Class A Common Stock,$47.76,-0.51,-1.06%,775930930,United States,2017,49357,Public Utilities,Natural Gas Distribution,NASDAQ
ALTR,Altair Engineering Inc. Class A Common Stock,$59.75,-1.83,-2.97%,4401025288,United States,2017,426009,Technology,Computer Software: Prepackaged Software,NASDAQ
ALTUU,Altitude Acquisition Corp. Unit,$10.64,0,0.00%,0,United States,2020,69808,Finance,Business Services,NASDAQ
ALVR,AlloVir Inc. Common Stock,$42.69,-2.35,-5.22%,2675355533,United States,2020,178408,Health Care,Biotechnology: Biological Products (No Diagnostic Substances),NASDAQ
ALXN,Alexion Pharmaceuticals Inc. Common Stock,$159.73,1.87,1.19%,34936236167,United States,1996,2790679,Health Care,Major Pharmaceuticals,NASDAQ
ALXO,ALX Oncology Holdings Inc. Common Stock,$81.47,0.48,0.59%,3023149817,United States,2020,113895,Health Care,Major Pharmaceuticals,NASDAQ
ALYA,Alithya Group inc. Class A Subordinate Voting Shares,$2.37,-0.042,-1.74%,137536364,Canada,,9035,Technology,Computer Software: Programming Data Processing,NASDAQ
AMAL,Amalgamated Bank Class A Common Stock,$15.03,0.23,1.55%,466674361,United States,2018,33286,Consumer Non-Durables,Textiles,NASDAQ
AMAT,Applied Materials Inc. Common Stock,$106.33,-1.64,-1.52%,97222217616,United States,1972,6207648,Technology,Semiconductors,NASDAQ
