Symbol,Name,Last Sale,Net Change,% Change,Market Cap,Country,IPO Year,Volume,Sector,Industry,Exchange
KEYS,Keysight Technologies Inc. Common Stock,$145.16,-1.52,-1.04%,27013413169,United States,2014,1289196,Capital Goods,Industrial Machinery/Components,NYSE
KF,Korea Fund Inc. (The) New Common Stock,$44.29,-0.6,-1.34%,222832690,United States,,7947,,,NYSE
KFS,Kingsway Financial Services Inc. Common Stock (DE),$4.75,-0.11,-2.26%,107877578,Canada,,4146,Finance,Property-Casualty Insurers,NYSE
KFY,Korn Ferry Common Stock,$47.89,-0.29,-0.60%,2583086606,United States,1999,243048,Technology,Diversified Commercial Services,NYSE
KGC,Kinross Gold Corporation Common Stock,$7.01,-0.12,-1.68%,8820683000,Canada,,14499004,Basic Industries,Precious Metals,NYSE
KIM,Kimco Realty Corporation Common Stock,$16.66,0.08,0.48%,7205427709,United States,,5289599,Consumer Services,Real Estate Investment Trusts,NYSE
KIM.PRL,Kimco Realty Corporation,NA,,,,,,0,,,NYSE
KIM.PRM,Kimco Realty Corporation,NA,,,,,,0,,,NYSE
KIO,KKR Income Opportunities Fund Common Shares,$14.66,-0.02,-0.14%,298189018,,2013,46034,,,NYSE
KKR,KKR & Co. Inc. Common Stock,$40.20,-0.94,-2.29%,22881401659,United States,,1873320,Finance,Investment Managers,NYSE
KKR.PRA,KKR & Co. Inc.,NA,,,,,,0,,,NYSE
KKR.PRB,KKR & Co. Inc.,NA,,,,,,0,,,NYSE
KKR.PRC,KKR & Co. Inc.,NA,,,,,,0,,,NYSE
KL,Kirkland Lake Gold Ltd. Common Shares,$40.17,-0.48,-1.18%,10726345122,,,1731130,Basic Industries,Precious Metals,NYSE
KMB,Kimberly-Clark Corporation Common Stock,$132.21,1.2,0.92%,44969475090,United States,,2497645,Consumer Durables,Containers/Packaging,NYSE
KMF,Kayne Anderson NextGen Energy & Infrastructure Inc.,$6.25,-0.05,-0.79%,294984138,,2010,231864,,,NYSE
KMI,Kinder Morgan Inc. Common Stock,$15.32,0.06,0.39%,34677366694,United States,2011,18001757,Public Utilities,Natural Gas Distribution,NYSE
KMPR,Kemper Corporation,$74.53,-0.87,-1.15%,4874889244,United States,,174229,Finance,Property-Casualty Insurers,NYSE
KMT,Kennametal Inc. Common Stock,$40.38,1.06,2.70%,3362686172,United States,,437826,Capital Goods,Industrial Machinery/Components,NYSE
KMX,CarMax Inc,$118.64,-1.65,-1.37%,19283917747,United States,,1349637,Consumer Durables,Automotive Aftermarket,NYSE
KN,Knowles Corporation Common Stock,$19.89,0.01,0.05%,1823391425,,2014,667576,Consumer Non-Durables,Consumer Electronics/Appliances,NYSE
KNL,Knoll Inc. Common Stock,$16.27,0.25,1.56%,824597002,United States,2004,166301,Consumer Durables,Office Equipment/Supplies/Services,NYSE
KNOP,KNOT Offshore Partners LP Common Units representing Limited Partner Interests,$17.14,-0.18,-1.04%,560376771,United Kingdom,2013,152586,Consumer Services,Marine Transportation,NYSE
KNX,Knight-Swift Transportation Holdings Inc.,$43.71,0.19,0.44%,7423336482,United States,2017,1414326,Transportation,Trucking Freight/Courier Services,NYSE
KO,Coca-Cola Company (The) Common Stock,$48.49,-0.46,-0.94%,208382604336,United States,,15400347,Consumer Non-Durables,Beverages (Production/Distribution),NYSE
KODK,Eastman Kodak Company Common New,$9.46,0.27,2.94%,729965064,United States,,9546947,Miscellaneous,Industrial Machinery/Components,NYSE
KOF,Coca Cola Femsa S.A.B. de C.V.  American Depositary Shares each representing 10 Units (each Unit consists of 3 Series B Shares and 5 Series L Shares),$46.39,0.02,0.04%,9745760854,Mexico,1993,131564,Consumer Non-Durables,Beverages (Production/Distribution),NYSE
KOP,Koppers Holdings Inc. Koppers Holdings Inc. Common Stock,$35.67,0.41,1.16%,751403424,United States,2006,133211,Basic Industries,Forest Products,NYSE
KOS,Kosmos Energy Ltd. Common Shares (DE),$2.68,0.13,5.10%,1086619529,Bermuda,2011,6652347,Energy,Oil & Gas Production,NYSE
KR,Kroger Company (The) Common Stock,$33.56,0.35,1.05%,25550807334,United States,,9458159,Consumer Services,Food Chains,NYSE
KRA,Kraton Corporation Common Stock,$31.41,0.22,0.71%,1001096222,United States,2009,238668,Basic Industries,Major Chemicals,NYSE
KRC,Kilroy Realty Corporation Common Stock,$58.01,-1.4,-2.36%,6685718399,United States,1997,1204102,Consumer Services,Real Estate Investment Trusts,NYSE
KREF,KKR Real Estate Finance Trust Inc. Common Stock,$17.89,-0.02,-0.11%,995031567,United States,2017,121105,Consumer Services,Real Estate Investment Trusts,NYSE
KRG,Kite Realty Group Trust Common Stock,$16.81,0.43,2.63%,1415461978,United States,2004,414710,Consumer Services,Real Estate Investment Trusts,NYSE
KRO,Kronos Worldwide Inc Common Stock,$15.37,0.23,1.52%,1775891560,United States,,100660,Basic Industries,Major Chemicals,NYSE
KRP,Kimbell Royalty Partners Common Units Representing Limited Partner Interests,$8.74,-0.11,-1.24%,525118061,United States,2017,149657,Energy,Oil & Gas Production,NYSE
KSM,DWS Strategic Municipal Income Trust,$11.62,0.06,0.52%,130189794,United States,1989,21795,,,NYSE
KSS,Kohl's Corporation Common Stock,$45.18,0.39,0.87%,7122735206,United States,1992,3594961,Consumer Services,Department/Specialty Retail Stores,NYSE
KSU,Kansas City Southern Common Stock,$217.58,4.59,2.16%,20365825031,United States,,1857595,Transportation,Railroads,NYSE
KSU.PR,Kansas City Southern,NA,,,,,,0,,,NYSE
KT,KT Corporation Common Stock,$10.77,-0.04,-0.37%,5213587480,South Korea,,522472,Public Utilities,Telecommunications Equipment,NYSE
KTB,Kontoor Brands Inc. Common Stock,$41.84,0.04,0.10%,2393472681,,2019,351545,Consumer Non-Durables,Apparel,NYSE
KTF,DWS Municipal Income Trust,$11.57,-0.03,-0.26%,457025853,United States,1988,73761,,,NYSE
KTH,Structures Products Cp 8% CorTS Issued by Peco Energy Cap Tr II Preferred Stock,$33.26,-0.22,-0.66%,0,United States,,2564,Finance,Finance: Consumer Services,NYSE
KTN,Structured Products Corp 8.205% CorTS 8.205% Corporate Backed Trust Securities (CorTS),$32.99,0.445,1.37%,0,United States,,356,Finance,Finance: Consumer Services,NYSE
KUKE,Kuke Music Holding Limited American Depositary Shares each representing one Ordinary Share,$9.43,0.07,0.75%,278814198,,2021,87552,Consumer Services,Other Consumer Services,NYSE
KW,Kennedy-Wilson Holdings Inc. Common Stock,$17.73,0.05,0.28%,2512865773,United States,,421293,Finance,Real Estate,NYSE
KWAC.U,Kingswood Acquisition Corp. Units each consisting of one share of Class A Common Stock and three-fourths of one redeemable warrant,NA,,,,,2020,0,,,NYSE
KWR,Quaker Chemical Corporation Common Stock,$273.90,4.84,1.80%,4884068666,United States,,57687,Basic Industries,Major Chemicals,NYSE
KYN,Kayne Anderson Energy Infrastructure Fund Inc.,$6.50,-0.12,-1.81%,821909101,United States,2004,1552889,,,NYSE
L,Loews Corporation Common Stock,$46.49,-0.04,-0.09%,12778839819,United States,,645305,Finance,Property-Casualty Insurers,NYSE
LAC,Lithium Americas Corp. Common Shares,$23.23,0.3,1.31%,2350686374,Canada,,8672545,Basic Industries,Precious Metals,NYSE
LAD,Lithia Motors Inc. Common Stock,$338.03,7.5,2.27%,8966006087,United States,,353525,Consumer Durables,Automotive Aftermarket,NYSE
LADR,Ladder Capital Corp Class A Common Stock,$10.49,0.11,1.06%,1303565624,,2014,733787,Consumer Services,Real Estate Investment Trusts,NYSE
LAIX,LAIX Inc. American Depositary Shares each  representing one Class A Ordinary Share,$1.80,0.03,1.70%,88942019,,2018,814552,Consumer Services,Other Consumer Services,NYSE
LAZ,Lazard LTD. Lazard LTD. Class A Common Stock,$43.44,0.16,0.37%,4562588473,Bermuda,2005,1091875,Finance,Investment Managers,NYSE
LB,L Brands Inc.,$45.28,-0.62,-1.35%,12592755733,United States,,2765876,Consumer Services,Clothing/Shoe/Accessory Stores,NYSE
LBRT,Liberty Oilfield Services Inc. Class A Common Stock,$12.58,0.55,4.57%,2255088548,United States,2018,806916,Energy,Oilfield Services/Equipment,NYSE
LC,LendingClub Corporation Common Stock,$11.61,0.05,0.43%,908281577,United States,2014,1067203,Finance,Finance: Consumer Services,NYSE
LCI,Lannett Co Inc Common Stock,$6.73,0.13,1.97%,280642999,United States,,241102,Health Care,Major Pharmaceuticals,NYSE
LCII,LCI Industries,$140.84,-1.8,-1.26%,3542715134,United States,,96979,Capital Goods,Auto Parts:O.E.M.,NYSE
LDL,Lydall Inc. Common Stock,$33.47,0.61,1.86%,593537869,United States,,64706,Capital Goods,Auto Parts:O.E.M.,NYSE
LDOS,Leidos Holdings Inc. Common Stock,$112.05,2.74,2.51%,15947065921,United States,,726654,Technology,EDP Services,NYSE
LDP,Cohen & Steers Limited Duration Preferred and Income Fund Inc.,$25.81,0.01,0.04%,746174120,United States,2012,31489,,,NYSE
LEA,Lear Corporation Common Stock,$167.08,-0.83,-0.49%,10031280031,United States,,212255,Capital Goods,Auto Parts:O.E.M.,NYSE
LEAF,Leaf Group Ltd. Common Stock,$5.48,0.17,3.20%,195125341,United States,,159837,Technology,EDP Services,NYSE
LEAP,Ribbit LEAP Ltd. Class A Ordinary Shares,$15.00,-0.09,-0.60%,877575000,United States,2020,168574,Finance,Business Services,NYSE
LEAP.U,Ribbit LEAP Ltd. Units each consisting of one Class A Ordinary Share and one fifth of one Warrant to acquire one Class A Ordinary Share,NA,,,,United States,2020,0,,,NYSE
LEAP.WS,Ribbit LEAP Ltd. Warrants each whole warrant exercisable for one Class A Ordinary Share at an exercise price of $11.50,NA,,,,United States,,0,,,NYSE
LEE,Lee Enterprises Incorporated Common Stock,$1.37,-0.04,-2.84%,80507409,United States,,179957,Consumer Services,Newspapers/Magazines,NYSE
LEG,Leggett & Platt Incorporated Common Stock,$44.19,-0.44,-0.99%,5856010854,United States,,926828,Consumer Durables,Home Furnishings,NYSE
LEJU,Leju Holdings Limited American Depositary Shares each representing one Ordinary share,$2.58,0.04,1.58%,351663515,,2014,128827,Finance,Real Estate,NYSE
LEN,Lennar Corporation Class A Common Stock,$84.62,1.02,1.22%,26463797578,United States,,2491215,Basic Industries,Homebuilding,NYSE
LEN.B,Lennar Corporation Class B,NA,,,,United States,,0,Basic Industries,Homebuilding,NYSE
LEO,BNY Mellon Strategic Municipals Inc. Common Stock,$8.41,0.07,0.84%,523184098,United States,1987,164156,,,NYSE
LEVI,Levi Strauss & Co Class A Common Stock,$20.80,-0.05,-0.24%,8261398226,United States,2019,900159,Consumer Non-Durables,Apparel,NYSE
LFC,China Life Insurance Company Limited American Depositary Shares,$11.31,-0.45,-3.83%,63934774020,China,2003,338156,Finance,Life Insurance,NYSE
LFT,Lument Finance Trust Inc. Common Stock,$3.25,-0.0362,-1.10%,81160780,United States,2013,21409,Consumer Services,Real Estate Investment Trusts,NYSE
LGF.A,Lions Gate Entertainment Corporation Class A Voting Shares,NA,,,,,,0,,,NYSE
LGF.B,Lions Gate Entertainment Corporation Class B Non-Voting Shares,NA,,,,Canada,2016,0,,,NYSE
LGI,Lazard Global Total Return and Income Fund Common Stock,$18.73,0.03,0.16%,243670951,United States,2004,38953,,,NYSE
LGVW,Longview Acquisition Corp. Class A Common Stock,$21.33,-0.79,-3.57%,1103827500,,2020,1330884,Health Care,Medical Electronics,NYSE
LGVW.U,Longview Acquisition Corp. Units each consisting of one share of Class A common stock and one-third of one warrant,NA,,,,,2020,0,,,NYSE
LGVW.WS,Longview Acquisition Corp. Redeemable Warrants each whole warrant exercisable for one share of Class A common stock each at an exercise price of $11.50 per share,NA,,,,,,0,,,NYSE
LH,Laboratory Corporation of America Holdings Common Stock,$228.90,0.45,0.20%,22294860000,United States,,612334,Health Care,Medical Specialities,NYSE
LHC.U,Leo Holdings Corp. II Units each consisting of one Class A ordinary share and one-third of one redeemable warrant,NA,,,,,2021,0,,,NYSE
LHX,L3Harris Technologies Inc. Common Stock,$183.80,0.67,0.37%,38618592401,United States,,1058366,Capital Goods,Industrial Machinery/Components,NYSE
LII,Lennox International Inc. Common Stock,$293.15,-0.35,-0.12%,11224537317,United States,1999,190703,Capital Goods,Industrial Machinery/Components,NYSE
LIN,Linde plc Ordinary Share,$251.48,-1.72,-0.68%,131990960653,,2018,1581985,Basic Industries,Major Chemicals,NYSE
LINX,Linx S.A. American Depositary Shares each representing one common share,$6.83,-0.06,-0.87%,1199984713,,2019,23599,Technology,Computer Software: Prepackaged Software,NYSE
LITB,LightInTheBox Holding Co. Ltd. American Depositary Shares each representing 2 ordinary shares,$2.62,0.07,2.75%,292852009,China,2013,314475,Consumer Services,Catalog/Specialty Distribution,NYSE
LL,Lumber Liquidators Holdings Inc Common Stock,$29.71,-3.73,-11.15%,857867604,United States,2007,1562500,Consumer Services,RETAIL: Building Materials,NYSE
LLY,Eli Lilly and Company Common Stock,$206.14,3.79,1.87%,197189730612,United States,,6128788,Health Care,Major Pharmaceuticals,NYSE
LMND,Lemonade Inc. Common Stock,$153.49,5.3,3.58%,8686080296,United States,2020,2891669,Finance,Property-Casualty Insurers,NYSE
LMT,Lockheed Martin Corporation Common Stock,$339.88,0.21,0.06%,95092899930,United States,,1557608,Capital Goods,Military/Government/Technical,NYSE
LNC,Lincoln National Corporation Common Stock,$50.70,-0.51,-1.00%,9798553245,United States,,1955284,Finance,Life Insurance,NYSE
LND,Brasilagro Brazilian Agric Real Estate Co Sponsored ADR (Brazil),$4.89,-0.23,-4.49%,289404503,Brazil,,71730,Consumer Non-Durables,Farming/Seeds/Milling,NYSE
LNFA,L&amp;F Acquisition Corp. Class A Ordinary Shares,$10.30,-0.04,-0.39%,0,United States,2021,38347,Finance,Business Services,NYSE
LNFA.U,L&amp;F Acquisition Corp. Units each consisting of one Class A ordinary share and one-half of one redeemable warrant,NA,,,,United States,2020,0,,,NYSE
LNFA.WS,L&amp;F Acquisition Corp. Warrants each whole warrant exercisable for one Class A ordinary share at an exercise price of $11.50,NA,,,,United States,,0,,,NYSE
LNN,Lindsay Corporation Common Stock,$149.91,1.13,0.76%,1628809028,United States,,87419,Capital Goods,Industrial Machinery/Components,NYSE
LOKB,Live Oak Acquisition Corp. II,NA,,,,,,0,,,NYSE
LOKB.U,Live Oak Acquisition Corp. II Units each consisting of one share of Class A common stock and one-third of one redeemable warrant,NA,,,,,2020,0,,,NYSE
LOKB.WS,Live Oak Acquisition Corp. II,NA,,,,,,0,,,NYSE
LOMA,Loma Negra Compania Industrial Argentina Sociedad Anonima ADS,$5.15,-0.08,-1.53%,613906780,Argentina,2017,61819,Capital Goods,Building Materials,NYSE
LOW,Lowe's Companies Inc. Common Stock,$172.40,0.06,0.04%,129644800000,United States,,3612323,Consumer Services,RETAIL: Building Materials,NYSE
LPG,Dorian LPG Ltd. Common Stock,$12.67,-0.08,-0.63%,644673534,,2014,679386,Transportation,Marine Transportation,NYSE
LPI,Laredo Petroleum Inc. Common Stock,$25.10,0.75,3.08%,301295531,United States,2011,443877,Energy,Oil & Gas Production,NYSE
LPL,LG Display Co Ltd AMERICAN DEPOSITORY SHARES,$10.51,-0.09,-0.85%,7521286014,South Korea,2004,854956,Capital Goods,Industrial Machinery/Components,NYSE
LPX,Louisiana-Pacific Corporation Common Stock,$40.03,0.51,1.29%,4376232555,United States,,1133338,Basic Industries,Forest Products,NYSE
LRN,Stride Inc. Common Stock,$24.70,-0.02,-0.08%,1025942930,United States,,561437,Consumer Services,Other Consumer Services,NYSE
LSI,Life Storage Inc. Common Stock,$122.37,1.21,1.00%,6054208393,United States,,309515,Consumer Services,Real Estate Investment Trusts,NYSE
LSPD,Lightspeed POS Inc. Subordinate Voting Shares,$69.13,-1.21,-1.72%,8143978139,,,724770,Technology,Computer Software: Prepackaged Software,NYSE
LTC,LTC Properties Inc. Common Stock,$40.09,0.48,1.21%,1573220800,United States,,168535,Consumer Services,Real Estate Investment Trusts,NYSE
LTHM,Livent Corporation Common Stock,$21.48,-0.1,-0.46%,3142578065,United States,2018,2833683,Basic Industries,Major Chemicals,NYSE
LU,Lufax Holding Ltd American Depositary Shares two of which representing one Ordinary Share,$15.45,-0.43,-2.71%,37669355576,China,2020,7034490,Finance,Finance: Consumer Services,NYSE
LUB,Luby's Inc. Common Stock,$2.83,-0.02,-0.70%,86820916,United States,,8192,Consumer Services,Restaurants,NYSE
LUMN,Lumen Technologies Inc. Common Stock,$11.17,0.08,0.72%,12254955839,United States,,7609245,Public Utilities,Telecommunications Equipment,NYSE
LUV,Southwest Airlines Company Common Stock,$47.39,-0.38,-0.80%,27982578830,United States,,4812538,Transportation,Air Freight/Delivery Services,NYSE
LVS,Las Vegas Sands Corp. Common Stock,$54.18,-1.2,-2.17%,41384207921,United States,2004,4991395,Consumer Services,Hotels/Resorts,NYSE
LW,Lamb Weston Holdings Inc. Common Stock,$78.15,1.08,1.40%,11437649658,,2016,844264,Consumer Non-Durables,Packaged Foods,NYSE
LXP,Lexington Realty Trust Common Stock,$10.47,0.22,2.15%,2899692822,United States,,1609020,,,NYSE
LXP.PRC,Lexington Realty Trust,NA,,,,,,0,,,NYSE
LXU,LSB Industries Inc. Common Stock,$3.68,-0.03,-0.81%,107887178,United States,,191408,Basic Industries,Major Chemicals,NYSE
LYB,LyondellBasell Industries NV Ordinary Shares Class A (Netherlands),$91.48,-1.14,-1.23%,30546916066,Netherlands,,1392103,Basic Industries,Major Chemicals,NYSE
LYG,Lloyds Banking Group Plc American Depositary Shares,$1.86,-0.04,-2.11%,32940230818,United Kingdom,,4143036,Finance,Commercial Banks,NYSE
LYV,Live Nation Entertainment Inc. Common Stock,$72.28,-2.31,-3.10%,15425787265,United States,,2667828,Consumer Services,Services-Misc. Amusement & Recreation,NYSE
LZB,La-Z-Boy Incorporated Common Stock,$44.18,0.79,1.82%,2038650005,United States,,252778,Consumer Durables,Home Furnishings,NYSE
M,Macy's Inc Common Stock,$12.88,0.56,4.55%,3998955468,United States,,19133129,Consumer Services,Department/Specialty Retail Stores,NYSE
MA,Mastercard Incorporated Common Stock,$328.99,-5.45,-1.63%,327978470239,United States,2006,3846597,Miscellaneous,Business Services,NYSE
MAA,Mid-America Apartment Communities Inc. Common Stock,$134.18,0.73,0.55%,15346141374,United States,1994,509936,Consumer Services,Real Estate Investment Trusts,NYSE
MAA.PRI,Mid-America Apartment Communities Inc.,NA,,,,,,0,,,NYSE
MAC,Macerich Company (The) Common Stock,$14.25,0.93,6.98%,2129982142,United States,1994,6979593,Consumer Services,Real Estate Investment Trusts,NYSE
MAIN,Main Street Capital Corporation Common Stock,$33.03,0.38,1.16%,2188981402,United States,2007,412098,,,NYSE
MAN,ManpowerGroup Common Stock,$95.29,0.35,0.37%,5482340343,United States,,260998,Technology,Professional Services,NYSE
MANU,Manchester United Ltd. Class A Ordinary Shares,$15.37,-0.52,-3.27%,2504375396,United Kingdom,2012,136975,Consumer Services,Services-Misc. Amusement & Recreation,NYSE
MAS,Masco Corporation Common Stock,$57.52,-0.5,-0.86%,15051597250,United States,,1713142,Capital Goods,Industrial Specialties,NYSE
MATX,Matson Inc. Common Stock,$67.59,1.01,1.52%,2911690347,United States,,175795,Consumer Services,Marine Transportation,NYSE
MAV,Pioneer Municipal High Income Advantage Trust Common Shares of Beneficial Interest,$11.69,-0.04,-0.34%,279379544,United States,,48417,,,NYSE
MAX,MediaAlpha Inc. Class A Common Stock,$44.50,2.51,5.98%,2612380688,,2020,136539,Finance,Property-Casualty Insurers,NYSE
MAXR,Maxar Technologies Inc.,$50.22,-0.86,-1.68%,3067172338,,,1676768,Technology,Radio And Television Broadcasting And Communications Equipment,NYSE
MBI,MBIA Inc. Common Stock,$6.74,-0.02,-0.30%,363476857,United States,1987,389955,Finance,Property-Casualty Insurers,NYSE
MBT,Mobile TeleSystems PJSC,$9.05,-0.12,-1.31%,8018010174,Russia,,3097148,Public Utilities,Telecommunications Equipment,NYSE
MC,Moelis & Company Class A Common Stock,$54.48,0.23,0.42%,3021760658,,2014,270484,Finance,Investment Managers,NYSE
MCA,Blackrock MuniYield California Quality Fund Inc. Common Stock,$14.95,0.03,0.20%,514365469,United States,1992,80314,,,NYSE
MCB,Metropolitan Bank Holding Corp. Common Stock,$39.50,1.36,3.57%,327663244,,2017,21038,Finance,Major Banks,NYSE
MCD,McDonald's Corporation Common Stock,$213.38,-0.15,-0.07%,158991782619,United States,,2196479,Consumer Services,Restaurants,NYSE
MCI,Barings Corporate Investors Common Stock,$13.68,0.22,1.63%,277180316,United States,,40540,,,NYSE
MCK,McKesson Corporation Common Stock,$185.01,2.22,1.22%,29706024269,United States,,917069,Health Care,Other Pharmaceuticals,NYSE
MCN,Madison Covered Call & Equity Strategy Fund Common Stock,$7.19,-0.03,-0.42%,150608384,United States,2004,82321,,,NYSE
MCO,Moody's Corporation Common Stock,$266.70,-4.07,-1.50%,50086260000,United States,,729687,Finance,Finance: Consumer Services,NYSE
MCR,MFS Charter Income Trust Common Stock,$8.69,0.05,0.58%,385097107,United States,1989,70598,,,NYSE
MCS,Marcus Corporation (The) Common Stock,$16.65,0.6,3.74%,517220462,United States,,702530,Consumer Services,Movies/Entertainment,NYSE
MCY,Mercury General Corporation Common Stock,$53.38,-0.05,-0.09%,2954993546,United States,,130473,Finance,Property-Casualty Insurers,NYSE
MD,Mednax Inc. Common Stock,$24.38,-0.11,-0.45%,2086886530,United States,,941469,Health Care,Hospital/Nursing Management,NYSE
MDC,M.D.C. Holdings Inc. Common Stock,$55.76,1.57,2.90%,3616995797,United States,,490841,Capital Goods,Homebuilding,NYSE
MDLA,Medallia Inc. Common Stock,$39.46,-0.09,-0.23%,5936700059,United States,2019,1127928,Technology,Computer Software: Programming Data Processing,NYSE
MDLQ,Medley LLC 7.25% Notes due 2024,$8.41,0.16,1.94%,0,,2017,10757,Finance,Investment Managers,NYSE
MDLX,Medley LLC 6.875% Senior Notes due 2026,$8.55,0.45,5.56%,0,,2016,77589,Finance,Investment Managers,NYSE
MDLY,Medley Management Inc. Class A Common Stock,$10.54,-0.28,-2.59%,60275130,United States,2014,271232,Finance,Investment Managers,NYSE
MDP,Meredith Corporation Common Stock,$19.25,0.32,1.69%,877159745,United States,,356026,Consumer Services,Newspapers/Magazines,NYSE
MDT,Medtronic plc. Ordinary Shares,$116.58,-1.33,-1.13%,156919005654,United States,,3028395,Health Care,Biotechnology: Electromedical & Electrotherapeutic Apparatus,NYSE
MDU,MDU Resources Group Inc. Common Stock (Holding Company),$27.73,0.16,0.58%,5560482741,United States,,971979,Basic Industries,Mining & Quarrying of Nonmetallic Minerals (No Fuels),NYSE
MEC,Mayville Engineering Company Inc. Common Stock,$13.61,0.13,0.96%,273008298,,2019,15683,Capital Goods,Industrial Specialties,NYSE
MED,MEDIFAST INC Common Stock,$220.87,-0.44,-0.20%,2599602352,United States,,87245,Consumer Non-Durables,Packaged Foods,NYSE
MEG,Montrose Environmental Group Inc. Common Stock,$42.49,0.52,1.24%,1060621783,United States,2020,192858,Consumer Services,Professional Services,NYSE
MEI,Methode Electronics Inc. Common Stock,$42.76,0.98,2.35%,1604771597,United States,,175714,Capital Goods,Electrical Products,NYSE
MEN,Blackrock MuniEnhanced Fund Inc Common Stock,$12.14,-0.01,-0.08%,360333119,United States,1989,56464,,,NYSE
MER.PRK,Merrill Lynch & Co. Inc.,NA,,,,,,0,,,NYSE
MET,MetLife Inc. Common Stock,$50.86,-0.21,-0.41%,45771381371,United States,2000,5322995,Finance,Life Insurance,NYSE
MET.PRA,MetLife Inc.,NA,,,,,,0,,,NYSE
MET.PRE,MetLife Inc.,NA,,,,,,0,,,NYSE
MET.PRF,MetLife Inc.,NA,,,,,,0,,,NYSE
MFA,MFA Financial Inc.,$3.87,0,0.00%,1754399561,United States,,3344322,Consumer Services,Real Estate Investment Trusts,NYSE
MFA.PRB,MFA Financial Inc.,NA,,,,,,0,,,NYSE
MFA.PRC,MFA Financial Inc.,NA,,,,,,0,,,NYSE
MFC,Manulife Financial Corporation Common Stock,$18.96,-0.32,-1.66%,36779158542,Canada,,1785729,Finance,Life Insurance,NYSE
MFD,Macquarie First Trust Global Common Stock,$8.65,-0.05,-0.58%,73935373,United States,2004,28008,,,NYSE
MFG,Mizuho Financial Group Inc. Sponosred ADR (Japan),$2.69,-0.02,-0.74%,34100882332,Japan,,224707,Finance,Major Banks,NYSE
MFGP,Micro Focus Intl PLC ADS each representing One Ord Sh,$5.53,-0.02,-0.36%,1852215894,,2017,715200,Technology,Computer Software: Prepackaged Software,NYSE
MFL,Blackrock MuniHoldings Investment Quality Fund Common Shares of Beneficial Interest,$14.34,-0.09,-0.62%,543431623,United States,1997,57703,,,NYSE
MFM,MFS Municipal Income Trust Common Stock,$6.62,0.01,0.15%,272662117,United States,1986,65080,,,NYSE
MFT,Blackrock MuniYield Investment Quality Fund Common Shares of Beneficial Interest,$14.51,0.06,0.42%,123026213,United States,1992,2760,,,NYSE
MFV,MFS Special Value Trust Common Stock,$5.90,-0.0099,-0.17%,42640495,United States,,3163,,,NYSE
MG,Mistras Group Inc Common Stock,$8.49,0.27,3.29%,247844851,United States,2009,88301,Consumer Services,Military/Government/Technical,NYSE
MGA,Magna International Inc. Common Stock,$76.00,-1.05,-1.36%,22744049484,Canada,,721893,Capital Goods,Auto Parts:O.E.M.,NYSE
MGF,MFS Government Markets Income Trust Common Stock,$4.52,0.01,0.22%,147290031,United States,1987,196245,,,NYSE
MGM,MGM Resorts International Common Stock,$31.39,-0.14,-0.44%,15504748318,United States,,8525949,Consumer Services,Hotels/Resorts,NYSE
MGP,MGM Growth Properties LLC Class A common shares representing limited liability company interests,$31.30,-0.42,-1.32%,9498548337,United States,2016,628551,Consumer Services,Real Estate Investment Trusts,NYSE
MGR,Affiliated Managers Group Inc. 5.875% Junior Subordinated Notes due 2059,$27.33,0.1389,0.51%,0,United States,2019,15353,Finance,Investment Managers,NYSE
MGRB,Affiliated Managers Group Inc. 4.750% Junior Subordinated Notes due 2060,$25.66,-0.02,-0.08%,0,United States,2020,23278,Finance,Investment Managers,NYSE
MGU,Macquarie Global Infrastructure Total Return Fund Inc. Common Stock,$20.32,-0.34,-1.65%,253355714,United States,2005,18504,,,NYSE
MGY,Magnolia Oil & Gas Corporation Class A Common Stock,$9.11,0.19,2.13%,2289343000,United States,2017,1082083,Energy,Oil & Gas Production,NYSE
MH.PRA,Maiden Holdings Ltd.,NA,,,,,,0,,,NYSE
MH.PRC,Maiden Holdings Ltd.,NA,,,,,,0,,,NYSE
MH.PRD,Maiden Holdings Ltd.,NA,,,,,,0,,,NYSE
MHD,Blackrock MuniHoldings Fund Inc. Common Stock,$16.32,0.18,1.12%,231902663,United States,1997,34692,,,NYSE
MHE,BlackRock Massachusetts Tax-Exempt Trust,$13.64,0.04,0.29%,32340754,United States,1993,320,,,NYSE
MHF,Western Asset Municipal High Income Fund Inc. Common Stock,$7.74,-0.01,-0.13%,167438909,United States,1988,38060,,,NYSE
MHI,Pioneer Municipal High Income Trust Common Shares of Beneficial Interest,$12.49,0.02,0.16%,284414149,,2003,75671,,,NYSE
